date,contexts,questions,answers
2022-12-06,2022년 12월 06일 01시 14분에 싱싱오징어바다에서 말했다 동기모임을 했다 오랜만에 친구를 만나서 좋았다,동기모임을 했다 오랜만에 친구를 만나서 좋았다를 말한 장소는 어디인가요?,싱싱오징어바다
2022-12-06,2022년 12월 06일 01시 14분에 싱싱오징어바다에서 말했다 동기모임을 했다 오랜만에 친구를 만나서 좋았다,2022년 12월 06일 01시 14분에 싱싱오징어바다에서 어떤 감정을 느꼈나요?,오랜만에 친구를 만나서 좋았다
2022-12-06,2022년 12월 06일 01시 14분에 싱싱오징어바다에서 말했다 동기모임을 했다 오랜만에 친구를 만나서 좋았다,2022년 12월 06일 01시 14분에 싱싱오징어바다에서 한 말은 무엇인가요?,동기모임을 했다 오랜만에 친구를 만나서 좋았다
2022-12-06,2022년 12월 06일 01시 14분에 싱싱오징어바다에서 말했다 동기모임을 했다 오랜만에 친구를 만나서 좋았다,2022년 12월 06일 01시 14분에 싱싱오징어바다에서 누구와 함께 행동했나요?,친구
2022-12-06,2022년 12월 06일 01시 14분에 싱싱오징어바다에서 말했다 동기모임을 했다 오랜만에 친구를 만나서 좋았다,동기모임을 했다 오랜만에 친구를 만나서 좋았다를 말한 시간은 몇 시 인가요?,01시 14분
2022-12-06,2022년 12월 06일 01시 14분에 싱싱오징어바다에서 말했다 동기모임을 했다 오랜만에 친구를 만나서 좋았다,동기모임을 했다 오랜만에 친구를 만나서 좋았다를 어떤 날짜에 말했나요?,44901
2022-12-06,2022년 12월 06일 01시 14분에 싱싱오징어바다에서 말했다 동기모임을 했다 오랜만에 친구를 만나서 좋았다,2022년 12월 06일 01시 14분에 싱싱오징어바다에서 무엇을 했나요?,동기모임을 했다
2022-12-06,2022년 12월 06일 21시 27분에 여우주막에서 말했다 가게 앞에서 귀여운 강아지를 봤다,2022년 12월 06일 21시 27분에 여우주막에서 무엇을 했나요?,가게 앞에서 귀여운 강아지를 봤다
2022-12-06,2022년 12월 06일 21시 27분에 여우주막에서 말했다 가게 앞에서 귀여운 강아지를 봤다,가게 앞에서 귀여운 강아지를 봤다를 어떤 날짜에 말했나요?,44901
2022-12-06,2022년 12월 06일 21시 27분에 여우주막에서 말했다 가게 앞에서 귀여운 강아지를 봤다,가게 앞에서 귀여운 강아지를 봤다를 말한 장소는 어디인가요?,여우주막
2022-12-06,2022년 12월 06일 21시 27분에 여우주막에서 말했다 가게 앞에서 귀여운 강아지를 봤다,2022년 12월 06일 21시 27분에 여우주막에서 한 말은 무엇인가요?,가게 앞에서 귀여운 강아지를 봤다
2022-12-06,2022년 12월 06일 21시 27분에 여우주막에서 말했다 가게 앞에서 귀여운 강아지를 봤다,가게 앞에서 귀여운 강아지를 봤다를 말한 시간은 몇 시 인가요?,21시 27분
2022-12-06,2022년 12월 06일 05시 12분에 롤링파스타에서 말했다 크림 파스타를 먹었다 사장님이 친절하셨다,2022년 12월 06일 05시 12분에 롤링파스타에서 한 말은 무엇인가요 ?,크림 파스타를 먹었다 사장님이 친절하셨다
2022-12-06,2022년 12월 06일 05시 12분에 롤링파스타에서 말했다 크림 파스타를 먹었다 사장님이 친절하셨다,2022년 12월 06일 05시 12분에 롤링파스타에서 무엇을 했나요 ?,크림 파스타를 먹었다
2022-12-06,2022년 12월 06일 05시 12분에 롤링파스타에서 말했다 크림 파스타를 먹었다 사장님이 친절하셨다,2022년 12월 06일 05시 12분에 롤링파스타에서 어떤 감정을 느꼈나요 ?,사장님이 친절하셨다
2022-12-06,2022년 12월 06일 05시 12분에 롤링파스타에서 말했다 크림 파스타를 먹었다 사장님이 친절하셨다,크림 파스타를 먹었다 사장님이 친절하셨다를 말한 장소는 어디인가요 ?,롤링파스타
2022-12-06,2022년 12월 06일 05시 12분에 롤링파스타에서 말했다 크림 파스타를 먹었다 사장님이 친절하셨다,크림 파스타를 먹었다 사장님이 친절하셨다를 말한 시간은 몇 시 인가요 ?,05시 12분
2022-12-06,2022년 12월 06일 05시 12분에 롤링파스타에서 말했다 크림 파스타를 먹었다 사장님이 친절하셨다,크림 파스타를 먹었다 사장님이 친절하셨다를 어떤 날짜에 말했나요 ?,44901
2022-12-06,2022년 12월 06일 00시 26분에 띵똥와플에서 말했다 떡볶이를 먹었다 떡이 딱딱했다, 떡볶이를 먹었다 떡이 딱딱했다를 어떤 날짜에 말했나요?,44901
2022-12-06,2022년 12월 06일 00시 26분에 띵똥와플에서 말했다 떡볶이를 먹었다 떡이 딱딱했다, 떡볶이를 먹었다 떡이 딱딱했다를 말한 시간은 몇 시 인가요?,00시 26분
2022-12-06,2022년 12월 06일 00시 26분에 띵똥와플에서 말했다 떡볶이를 먹었다 떡이 딱딱했다, 떡볶이를 먹었다 떡이 딱딱했다를 말한 장소는 어디인가요?,띵똥와플
2022-12-06,2022년 12월 06일 00시 26분에 띵똥와플에서 말했다 떡볶이를 먹었다 떡이 딱딱했다,2022년 12월 06일 00시 26분에 낙원스낵에서 무엇을 했나요?,떡볶이를 먹었다
2022-12-06,2022년 12월 06일 00시 26분에 띵똥와플에서 말했다 떡볶이를 먹었다 떡이 딱딱했다,2022년 12월 06일 00시 26분에 낙원스낵에서 어떤 감정을 느꼈나요?,떡이 딱딱했다
2022-12-06,2022년 12월 06일 00시 26분에 띵똥와플에서 말했다 떡볶이를 먹었다 떡이 딱딱했다,2022년 12월 06일 00시 26분에 낙원스낵에서 한 말은 무엇인가요?,떡볶이를 먹었다 떡이 딱딱했다
2022-12-06,2022년 12월 06일 15시 42분에 힙덱에서 말했다 모르는 사람이랑 밥 먹었다 재미있었다,모르는 사람이랑 밥 먹었다 재미있었다를 어떤 날짜에 말했나요?,44901
2022-12-06,2022년 12월 06일 15시 42분에 힙덱에서 말했다 모르는 사람이랑 밥 먹었다 재미있었다,모르는 사람이랑 밥 먹었다 재미있었다를 말한 시간은 몇 시 인가요?,15시 42분
2022-12-06,2022년 12월 06일 15시 42분에 힙덱에서 말했다 모르는 사람이랑 밥 먹었다 재미있었다,모르는 사람이랑 밥 먹었다 재미있었다를 말한 장소는 어디인가요?,힙덱
2022-12-06,2022년 12월 06일 15시 42분에 힙덱에서 말했다 모르는 사람이랑 밥 먹었다 재미있었다,2022년 12월 06일 15시 42분에 힙덱에서 무엇을 했나요?,모르는 사람이랑 밥 먹었다
2022-12-06,2022년 12월 06일 15시 42분에 힙덱에서 말했다 모르는 사람이랑 밥 먹었다 재미있었다,2022년 12월 06일 15시 42분에 힙덱에서 어떤 감정을 느꼈나요?,재미있었다
2022-12-06,2022년 12월 06일 15시 42분에 힙덱에서 말했다 모르는 사람이랑 밥 먹었다 재미있었다,2022년 12월 06일 15시 42분에 힙덱에서 한 말은 무엇인가요?,모르는 사람이랑 밥 먹었다 재미있었다
2022-12-06,2022년 12월 06일 12시 25분에 한양대학교에서 말했다 피자를 먹었다 이전보다 가격이 올라서 슬펐다,2022년 12월 06일 12시 25분에 한양대학교에서 어떤 감정을 느꼈나요?,이전보다 가격이 올라서 슬펐다
2022-12-06,2022년 12월 06일 12시 25분에 한양대학교에서 말했다 피자를 먹었다 이전보다 가격이 올라서 슬펐다,2022년 12월 06일 12시 25분에 한양대학교에서 무엇을 했나요?,피자를 먹었다 
2022-12-06,2022년 12월 06일 12시 25분에 한양대학교에서 말했다 피자를 먹었다 이전보다 가격이 올라서 슬펐다,피자를 먹었다 이전보다 가격이 올라서 슬펐다를 말한 장소는 어디인가요?,한양대학교
2022-12-06,2022년 12월 06일 12시 25분에 한양대학교에서 말했다 피자를 먹었다 이전보다 가격이 올라서 슬펐다,피자를 먹었다 이전보다 가격이 올라서 슬펐다를 말한 시간은 몇 시 인가요?,12시 25분
2022-12-06,2022년 12월 06일 12시 25분에 한양대학교에서 말했다 피자를 먹었다 이전보다 가격이 올라서 슬펐다,피자를 먹었다 이전보다 가격이 올라서 슬펐다를 어떤 날짜에 말했나요?,44901
2022-12-06,2022년 12월 06일 12시 25분에 한양대학교에서 말했다 피자를 먹었다 이전보다 가격이 올라서 슬펐다,2022년 12월 06일 12시 25분에 한양대학교에서 한 말은 무엇인가요?,피자를 먹었다 이전보다 가격이 올라서 슬펐다
2022-12-06,2022년 12월 06일 17시 00분에 싱싱오징어바다에서 말했다 제육볶음을 먹었다 양파가 많았다,제육볶음을 먹었다 양파가 많았다를 어떤 날짜에 말했나요?,44901
2022-12-06,2022년 12월 06일 17시 00분에 싱싱오징어바다에서 말했다 제육볶음을 먹었다 양파가 많았다,제육볶음을 먹었다 양파가 많았다를 말한 장소는 어디인가요?,싱싱오징어바다
2022-12-06,2022년 12월 06일 17시 00분에 싱싱오징어바다에서 말했다 제육볶음을 먹었다 양파가 많았다,제육볶음을 먹었다 양파가 많았다를 말한 시간은 몇 시 인가요?,17시 00분
2022-12-06,2022년 12월 06일 17시 00분에 싱싱오징어바다에서 말했다 제육볶음을 먹었다 양파가 많았다,2022년 12월 06일 17시 00분에 싱싱오징어바다에서 무엇을 했나요?,제육볶음을 먹었다
2022-12-06,2022년 12월 06일 17시 00분에 싱싱오징어바다에서 말했다 제육볶음을 먹었다 양파가 많았다,2022년 12월 06일 17시 00분에 싱싱오징어바다에서 어떤 감정을 느꼈나요?,양파가 많았다
2022-12-07,2022년 12월 07일 15시 47분에 싱싱오징어바다에서 말했다 동기들이랑 회랑 소주를 먹었다 술이 비쌌다,2022년 12월 07일 15시 47분에 싱싱오징어바다에서 무엇을 했나요 ?,동기들이랑 회랑 소주를 먹었다
2022-12-07,2022년 12월 07일 15시 47분에 싱싱오징어바다에서 말했다 동기들이랑 회랑 소주를 먹었다 술이 비쌌다,동기들이랑 회랑 소주를 먹었다 술이 비쌌다를 말한 시간은 몇 시 인가요 ?,15시 47분
2022-12-07,2022년 12월 07일 15시 47분에 싱싱오징어바다에서 말했다 동기들이랑 회랑 소주를 먹었다 술이 비쌌다,동기들이랑 회랑 소주를 먹었다 술이 비쌌다를 말한 장소는 어디인가요 ?,싱싱오징어바다
2022-12-07,2022년 12월 07일 15시 47분에 싱싱오징어바다에서 말했다 동기들이랑 회랑 소주를 먹었다 술이 비쌌다,2022년 12월 07일 15시 47분에 싱싱오징어바다에서 누구와 함께 행동했나요 ?,동기들
2022-12-07,2022년 12월 07일 15시 47분에 싱싱오징어바다에서 말했다 동기들이랑 회랑 소주를 먹었다 술이 비쌌다,2022년 12월 07일 15시 47분에 싱싱오징어바다에서 한 말은 무엇인가요 ?,동기들이랑 회랑 소주를 먹었다 술이 비쌌다
2022-12-07,2022년 12월 07일 15시 47분에 싱싱오징어바다에서 말했다 동기들이랑 회랑 소주를 먹었다 술이 비쌌다,2022년 12월 07일 15시 47분에 싱싱오징어바다에서 어떤 감정을 느꼈나요 ?,술이 비쌌다
2022-12-07,2022년 12월 07일 15시 47분에 싱싱오징어바다에서 말했다 동기들이랑 회랑 소주를 먹었다 술이 비쌌다,동기들이랑 회랑 소주를 먹었다 술이 비쌌다를 어떤 날짜에 말했나요 ?,44902
2022-12-07,2022년 12월 07일 06시 48분에 한양대학교에서 말했다 석철이랑 제육볶음 먹었다 맛있었다,2022년 12월 07일 06시 48분에 한양대학교에서 무엇을 했나요?,석철이랑 제육볶음 먹었다
2022-12-07,2022년 12월 07일 06시 48분에 한양대학교에서 말했다 석철이랑 제육볶음 먹었다 맛있었다,2022년 12월 07일 06시 48분에 한양대학교에서 한 말은 무엇인가요?,석철이랑 제육볶음 먹었다 맛있었다
2022-12-07,2022년 12월 07일 06시 48분에 한양대학교에서 말했다 석철이랑 제육볶음 먹었다 맛있었다,석철이랑 제육볶음 먹었다 맛있었다를 어떤 날짜에 말했나요?,44902
2022-12-07,2022년 12월 07일 06시 48분에 한양대학교에서 말했다 석철이랑 제육볶음 먹었다 맛있었다,석철이랑 제육볶음 먹었다 맛있었다를 말한 시간은 몇 시 인가요?,06시 48분
2022-12-07,2022년 12월 07일 06시 48분에 한양대학교에서 말했다 석철이랑 제육볶음 먹었다 맛있었다,석철이랑 제육볶음 먹었다 맛있었다를 말한 장소는 어디인가요?,한양대학교
2022-12-07,2022년 12월 07일 06시 48분에 한양대학교에서 말했다 석철이랑 제육볶음 먹었다 맛있었다,2022년 12월 07일 06시 48분에 한양대학교에서 누구와 함께 행동했나요?,석철
2022-12-07,2022년 12월 07일 06시 48분에 한양대학교에서 말했다 석철이랑 제육볶음 먹었다 맛있었다,2022년 12월 07일 06시 48분에 한양대학교에서 어떤 감정을 느꼈나요?,맛있었다
2022-12-07,2022년 12월 07일 09시 17분에 히토리우동에서 말했다 모르는 사람이랑 밥 먹었다 재미있었다,2022년 12월 07일 09시 17분에 히토리우동에서 어떤 감정을 느꼈나요?,재미있었다
2022-12-07,2022년 12월 07일 09시 17분에 히토리우동에서 말했다 모르는 사람이랑 밥 먹었다 재미있었다,모르는 사람이랑 밥 먹었다 재미있었다를 말한 시간은 몇 시 인가요?,09시 17분
2022-12-07,2022년 12월 07일 09시 17분에 히토리우동에서 말했다 모르는 사람이랑 밥 먹었다 재미있었다,모르는 사람이랑 밥 먹었다 재미있었다를 말한 장소는 어디인가요?,히토리우동
2022-12-07,2022년 12월 07일 09시 17분에 히토리우동에서 말했다 모르는 사람이랑 밥 먹었다 재미있었다,2022년 12월 07일 09시 17분에 히토리우동에서 무엇을 했나요?,모르는 사람이랑 밥 먹었다
2022-12-07,2022년 12월 07일 09시 17분에 히토리우동에서 말했다 모르는 사람이랑 밥 먹었다 재미있었다,2022년 12월 07일 09시 17분에 히토리우동에서 한 말은 무엇인가요?,모르는 사람이랑 밥 먹었다 재미있었다
2022-12-07,2022년 12월 07일 09시 17분에 히토리우동에서 말했다 모르는 사람이랑 밥 먹었다 재미있었다,모르는 사람이랑 밥 먹었다 재미있었다를 어떤 날짜에 말했나요?,44902
2022-12-07,2022년 12월 07일 01시 53분에 일락라멘에서 말했다 고기를 먹었는데 오늘은 맛이 없었다,고기를 먹었는데 오늘은 맛이 없었다를 어떤 날짜에 말했나요?,44902
2022-12-07,2022년 12월 07일 01시 53분에 일락라멘에서 말했다 고기를 먹었는데 오늘은 맛이 없었다,2022년 12월 07일 01시 53분에 일락라멘에서 무엇을 했나요?,고기를 먹었는데
2022-12-07,2022년 12월 07일 01시 53분에 일락라멘에서 말했다 고기를 먹었는데 오늘은 맛이 없었다,고기를 먹었는데 오늘은 맛이 없었다를 말한 장소는 어디인가요?,일락라멘
2022-12-07,2022년 12월 07일 01시 53분에 일락라멘에서 말했다 고기를 먹었는데 오늘은 맛이 없었다,2022년 12월 07일 01시 53분에 일락라멘에서 한 말은 무엇인가요?,고기를 먹었는데 오늘은 맛이 없었다
2022-12-07,2022년 12월 07일 01시 53분에 일락라멘에서 말했다 고기를 먹었는데 오늘은 맛이 없었다,2022년 12월 07일 01시 53분에 일락라멘에서 어떤 감정을 느꼈나요?,오늘은 맛이 없었다
2022-12-07,2022년 12월 07일 01시 53분에 일락라멘에서 말했다 고기를 먹었는데 오늘은 맛이 없었다,고기를 먹었는데 오늘은 맛이 없었다를 말한 시간은 몇 시 인가요?,01시 53분
2022-12-07,2022년 12월 07일 09시 57분에 한양대학교에서 말했다 기말고사가 코앞이다 오늘 소프트웨어공학 수업이 너무 힘들었다,2022년 12월 07일 09시 57분에 한양대학교에서 어떤 감정을 느꼈나요?,소프트웨어공학 수업이 너무 힘들었다
2022-12-07,2022년 12월 07일 09시 57분에 한양대학교에서 말했다 기말고사가 코앞이다 오늘 소프트웨어공학 수업이 너무 힘들었다,기말고사가 코앞이다 오늘 소프트웨어공학 수업이 너무 힘들었다를 말한 시간은 몇 시 인가요?,09시 57분
2022-12-07,2022년 12월 07일 09시 57분에 한양대학교에서 말했다 기말고사가 코앞이다 오늘 소프트웨어공학 수업이 너무 힘들었다,기말고사가 코앞이다 오늘 소프트웨어공학 수업이 너무 힘들었다를 말한 장소는 어디인가요?,한양대학교
2022-12-07,2022년 12월 07일 09시 57분에 한양대학교에서 말했다 기말고사가 코앞이다 오늘 소프트웨어공학 수업이 너무 힘들었다,2022년 12월 07일 09시 57분에 한양대학교에서 한 말은 무엇인가요?,기말고사가 코앞이다 오늘 소프트웨어공학 수업이 너무 힘들었다
2022-12-07,2022년 12월 07일 09시 57분에 한양대학교에서 말했다 기말고사가 코앞이다 오늘 소프트웨어공학 수업이 너무 힘들었다,기말고사가 코앞이다 오늘 소프트웨어공학 수업이 너무 힘들었다를 어떤 날짜에 말했나요?,44902
2022-12-07,2022년 12월 07일 21시 16분에 은화수식당에서 말했다 바질파스타를 먹었다 파스타 면이 딱딱했다,2022년 12월 07일 21시 16분에 은화수식당에서 한 말은 무엇인가요?,바질파스타를 먹었다 파스타 면이 딱딱했다
2022-12-07,2022년 12월 07일 21시 16분에 은화수식당에서 말했다 바질파스타를 먹었다 파스타 면이 딱딱했다,2022년 12월 07일 21시 16분에 은화수식당에서 어떤 감정을 느꼈나요?,파스타 면이 딱딱했다
2022-12-07,2022년 12월 07일 21시 16분에 은화수식당에서 말했다 바질파스타를 먹었다 파스타 면이 딱딱했다,바질파스타를 먹었다 파스타 면이 딱딱했다를 말한 시간은 몇 시 인가요?,21시 16분
2022-12-07,2022년 12월 07일 21시 16분에 은화수식당에서 말했다 바질파스타를 먹었다 파스타 면이 딱딱했다,2022년 12월 07일 21시 16분에 은화수식당에서 무엇을 했나요?,바질파스타를 먹었다
2022-12-07,2022년 12월 07일 21시 16분에 은화수식당에서 말했다 바질파스타를 먹었다 파스타 면이 딱딱했다,바질파스타를 먹었다 파스타 면이 딱딱했다를 말한 장소는 어디인가요?,은화수식당
2022-12-07,2022년 12월 07일 21시 16분에 은화수식당에서 말했다 바질파스타를 먹었다 파스타 면이 딱딱했다,바질파스타를 먹었다 파스타 면이 딱딱했다를 어떤 날짜에 말했나요?,44902
2022-12-07,2022년 12월 07일 21시 49분에 마쿠 마라탕에서 말했다 시간 웨이팅하고 마라탕을 먹었다 사장님이 친절하셨다,2022년 12월 07일 21시 49분에 마쿠 마라탕에서 무엇을 했나요 ?,시간 웨이팅하고 마라탕을 먹었다
2022-12-07,2022년 12월 07일 21시 49분에 마쿠 마라탕에서 말했다 시간 웨이팅하고 마라탕을 먹었다 사장님이 친절하셨다,한시간 웨이팅하고 마라탕을 먹었다 사장님이 친절하셨다를 말한 시간은 몇 시 인가요 ?,21시 49분
2022-12-07,2022년 12월 07일 21시 49분에 마쿠 마라탕에서 말했다 시간 웨이팅하고 마라탕을 먹었다 사장님이 친절하셨다,한시간 웨이팅하고 마라탕을 먹었다 사장님이 친절하셨다를 어떤 날짜에 말했나요 ?,44902
2022-12-07,2022년 12월 07일 21시 49분에 마쿠 마라탕에서 말했다 시간 웨이팅하고 마라탕을 먹었다 사장님이 친절하셨다,한시간 웨이팅하고 마라탕을 먹었다 사장님이 친절하셨다를 말한 장소는 어디인가요 ?,마쿠 마라탕
2022-12-07,2022년 12월 07일 21시 49분에 마쿠 마라탕에서 말했다 시간 웨이팅하고 마라탕을 먹었다 사장님이 친절하셨다,2022년 12월 07일 21시 49분에 마쿠 마라탕에서 어떤 감정을 느꼈나요 ?,사장님이 친절하셨다
2022-12-07,2022년 12월 07일 21시 49분에 마쿠 마라탕에서 말했다 시간 웨이팅하고 마라탕을 먹었다 사장님이 친절하셨다,2022년 12월 07일 21시 49분에 마쿠 마라탕에서 한 말은 무엇인가요 ?,시간 웨이팅하고 마라탕을 먹었다 사장님이 친절하셨다
2022-12-08,2022년 12월 08일 08시 37분에 니캉내캉에서 말했다 오늘 교수님이 기분이 좋지 않은 듯 했다,2022년 12월 08일 08시 37분에 니캉내캉에서 어떤 감정을 느꼈나요?,오늘 교수님이 기분이 좋지 않은 듯 했다
2022-12-08,2022년 12월 08일 08시 37분에 니캉내캉에서 말했다 오늘 교수님이 기분이 좋지 않은 듯 했다,오늘 교수님이 기분이 좋지 않은 듯 했다를 말한 장소는 어디인가요?,니캉내캉
2022-12-08,2022년 12월 08일 08시 37분에 니캉내캉에서 말했다 오늘 교수님이 기분이 좋지 않은 듯 했다,오늘 교수님이 기분이 좋지 않은 듯 했다를 말한 시간은 몇 시 인가요?,08시 37분
2022-12-08,2022년 12월 08일 08시 37분에 니캉내캉에서 말했다 오늘 교수님이 기분이 좋지 않은 듯 했다,교수님이 기분이 좋지 않은 듯 했다를 어떤 날짜에 말했나요?,44903
2022-12-08,2022년 12월 08일 08시 37분에 니캉내캉에서 말했다 오늘 교수님이 기분이 좋지 않은 듯 했다,2022년 12월 08일 08시 37분에 니캉내캉에서 한 말은 무엇인가요?,오늘 교수님이 기분이 좋지 않은 듯 했다
2022-12-08,2022년 12월 08일 23시 46분에 철남에서 말했다 동기모임을 했다 오랜만에 친구를 만나서 좋았다,동기모임을 했다 오랜만에 친구를 만나서 좋았다를 말한 장소는 어디인가요?,철남
2022-12-08,2022년 12월 08일 23시 46분에 철남에서 말했다 동기모임을 했다 오랜만에 친구를 만나서 좋았다,2022년 12월 08일 23시 46분에 철남에서 무엇을 했나요?,동기모임을 했다
2022-12-08,2022년 12월 08일 23시 46분에 철남에서 말했다 동기모임을 했다 오랜만에 친구를 만나서 좋았다,2022년 12월 08일 23시 46분에 철남에서 한 말은 무엇인가요?,동기모임을 했다 오랜만에 친구를 만나서 좋았다
2022-12-08,2022년 12월 08일 23시 46분에 철남에서 말했다 동기모임을 했다 오랜만에 친구를 만나서 좋았다,2022년 12월 08일 23시 46분에 철남에서 어떤 감정을 느꼈나요?,오랜만에 친구를 만나서 좋았다
2022-12-08,2022년 12월 08일 23시 46분에 철남에서 말했다 동기모임을 했다 오랜만에 친구를 만나서 좋았다,동기모임을 했다 오랜만에 친구를 만나서 좋았다를 어떤 날짜에 말했나요?,44903
2022-12-08,2022년 12월 08일 23시 46분에 철남에서 말했다 동기모임을 했다 오랜만에 친구를 만나서 좋았다,동기모임을 했다 오랜만에 친구를 만나서 좋았다를 말한 시간은 몇 시 인가요?,23시 46분
2022-12-08,2022년 12월 08일 15시 23분에 마쿠 마라탕에서 말했다 한양대점 버블이 딱딱했다,한양대점 버블이 딱딱했다를 말한 시간은 몇 시 인가요?,15시 23분
2022-12-08,2022년 12월 08일 15시 23분에 마쿠 마라탕에서 말했다 한양대점 버블이 딱딱했다,한양대점 버블이 딱딱했다를 어떤 날짜에 말했나요?,44903
2022-12-08,2022년 12월 08일 15시 23분에 마쿠 마라탕에서 말했다 한양대점 버블이 딱딱했다,2022년 12월 08일 15시 23분에 마쿠 마라탕에서 한 말은 무엇인가요?,한양대점 버블이 딱딱했다
2022-12-08,2022년 12월 08일 15시 23분에 마쿠 마라탕에서 말했다 한양대점 버블이 딱딱했다,한양대점 버블이 딱딱했다를 말한 장소는 어디인가요?,마쿠 마라탕
2022-12-08,2022년 12월 08일 15시 23분에 마쿠 마라탕에서 말했다 한양대점 버블이 딱딱했다,2022년 12월 08일 15시 23분에 마쿠 마라탕에서 어떤 감정을 느꼈나요?,한양대점 버블이 딱딱했다
2022-12-08,2022년 12월 08일 05시 48분에 와플대학에서 말했다 오늘 하늘이가 나한테 화냈다 무슨 일 때문이지,2022년 12월 08일 05시 48분에 와플대학에서 한 말은 무엇인가요?,오늘 하늘이가 나한테 화냈다 무슨 일 때문이지
2022-12-08,2022년 12월 08일 05시 48분에 와플대학에서 말했다 오늘 하늘이가 나한테 화냈다 무슨 일 때문이지,오늘 하늘이가 나한테 화냈다 무슨 일 때문이지를 어떤 날짜에 말했나요?,44903
2022-12-08,2022년 12월 08일 05시 48분에 와플대학에서 말했다 오늘 하늘이가 나한테 화냈다 무슨 일 때문이지,2022년 12월 08일 05시 48분에 와플대학에서 어떤 감정을 느꼈나요?,무슨 일 때문이지
2022-12-08,2022년 12월 08일 05시 48분에 와플대학에서 말했다 오늘 하늘이가 나한테 화냈다 무슨 일 때문이지,2022년 12월 08일 05시 48분에 와플대학에서 무엇을 했나요?,오늘 하늘이가 나한테 화냈다
2022-12-08,2022년 12월 08일 05시 48분에 와플대학에서 말했다 오늘 하늘이가 나한테 화냈다 무슨 일 때문이지,오늘 하늘이가 나한테 화냈다 무슨 일 때문이지를 말한 장소는 어디인가요?,와플대학
2022-12-08,2022년 12월 08일 05시 48분에 와플대학에서 말했다 오늘 하늘이가 나한테 화냈다 무슨 일 때문이지,오늘 하늘이가 나한테 화냈다 무슨 일 때문이지를 말한 시간은 몇 시 인가요?, 05시 48분
2022-12-08,2022년 12월 08일 11시 02분에 맘스터치에서 말했다 피자를 먹었다 이전보다 가격이 올라서 슬펐다,2022년 12월 08일 11시 02분에 맘스터치에서 무엇을 했나요?,피자를 먹었다
2022-12-08,2022년 12월 08일 11시 02분에 맘스터치에서 말했다 피자를 먹었다 이전보다 가격이 올라서 슬펐다,2022년 12월 08일 11시 02분에 맘스터치에서 한 말은 무엇인가요?,피자를 먹었다 이전보다 가격이 올라서 슬펐다
2022-12-08,2022년 12월 08일 11시 02분에 맘스터치에서 말했다 피자를 먹었다 이전보다 가격이 올라서 슬펐다,피자를 먹었다 이전보다 가격이 올라서 슬펐다를 말한 시간은 몇 시 인가요?,11시 02분
2022-12-08,2022년 12월 08일 11시 02분에 맘스터치에서 말했다 피자를 먹었다 이전보다 가격이 올라서 슬펐다,피자를 먹었다 이전보다 가격이 올라서 슬펐다를 어떤 날짜에 말했나요?,44903
2022-12-08,2022년 12월 08일 11시 02분에 맘스터치에서 말했다 피자를 먹었다 이전보다 가격이 올라서 슬펐다,피자를 먹었다 이전보다 가격이 올라서 슬펐다를 말한 장소는 어디인가요?,맘스터치
2022-12-08,2022년 12월 08일 11시 02분에 맘스터치에서 말했다 피자를 먹었다 이전보다 가격이 올라서 슬펐다,2022년 12월 08일 11시 02분에 맘스터치에서 어떤 감정을 느꼈나요?,이전보다 가격이 올라서 슬펐다
2022-12-08,2022년 12월 08일 08시 26분에 호말커피에서 말했다 바질파스타를 먹었다 파스타 면이 딱딱했다,바질파스타를 먹었다 파스타 면이 딱딱했다를 어떤 날짜에 말했나요?,44903
2022-12-08,2022년 12월 08일 08시 26분에 호말커피에서 말했다 바질파스타를 먹었다 파스타 면이 딱딱했다,2022년 12월 08일 08시 26분에 호말커피에서 어떤 감정을 느꼈나요?,파스타 면이 딱딱했다
2022-12-08,2022년 12월 08일 08시 26분에 호말커피에서 말했다 바질파스타를 먹었다 파스타 면이 딱딱했다,2022년 12월 08일 08시 26분에 호말커피에서 무엇을 했나요?,바질파스타를 먹었다
2022-12-08,2022년 12월 08일 08시 26분에 호말커피에서 말했다 바질파스타를 먹었다 파스타 면이 딱딱했다,바질파스타를 먹었다 파스타 면이 딱딱했다를 말한 장소는 어디인가요?,호말커피
2022-12-08,2022년 12월 08일 08시 26분에 호말커피에서 말했다 바질파스타를 먹었다 파스타 면이 딱딱했다,바질파스타를 먹었다 파스타 면이 딱딱했다를 말한 시간은 몇 시 인가요?,08시 26분
2022-12-08,2022년 12월 08일 08시 26분에 호말커피에서 말했다 바질파스타를 먹었다 파스타 면이 딱딱했다,2022년 12월 08일 08시 26분에 호말커피에서 한 말은 무엇인가요?,바질파스타를 먹었다 파스타 면이 딱딱했다
2022-12-08,2022년 12월 08일 13시 33분에 롤링파스타에서 말했다 크림 파스타를 먹었다 사장님이 친절하셨다,2022년 12월 08일 13시 33분에 롤링파스타에서 무엇을 했나요?,크림 파스타를 먹었다
2022-12-08,2022년 12월 08일 13시 33분에 롤링파스타에서 말했다 크림 파스타를 먹었다 사장님이 친절하셨다,2022년 12월 08일 13시 33분에 롤링파스타에서 한 말은 무엇인가요?,크림 파스타를 먹었다 사장님이 친절하셨다
2022-12-08,2022년 12월 08일 13시 33분에 롤링파스타에서 말했다 크림 파스타를 먹었다 사장님이 친절하셨다,2022년 12월 08일 13시 33분에 롤링파스타에서 어떤 감정을 느꼈나요?,사장님이 친절하셨다
2022-12-08,2022년 12월 08일 13시 33분에 롤링파스타에서 말했다 크림 파스타를 먹었다 사장님이 친절하셨다,크림 파스타를 먹었다 사장님이 친절하셨다를 어떤 날짜에 말했나요?,44903
2022-12-08,2022년 12월 08일 13시 33분에 롤링파스타에서 말했다 크림 파스타를 먹었다 사장님이 친절하셨다,크림 파스타를 먹었다 사장님이 친절하셨다를 말한 시간은 몇 시 인가요?,13시 33분
2022-12-08,2022년 12월 08일 13시 33분에 롤링파스타에서 말했다 크림 파스타를 먹었다 사장님이 친절하셨다,크림 파스타를 먹었다 사장님이 친절하셨다를 말한 장소는 어디인가요?,롤링파스타
2020-12-09,2022년 12월 09일 12시 18분에 엘루이피자에서 말했다 점심을 먹었다 사장님이 서비스를 줬다,점심을 먹었다 사장님이 서비스를 줬다를 말한 장소는 어디인가요?,엘루이피자
2020-12-09,2022년 12월 09일 12시 18분에 엘루이피자에서 말했다 점심을 먹었다 사장님이 서비스를 줬다,2022년 12월 09일 12시 18분에 엘루이피자에서 무엇을 했나요?,말했다 점심을 먹었다
2020-12-09,2022년 12월 09일 12시 18분에 엘루이피자에서 말했다 점심을 먹었다 사장님이 서비스를 줬다,2022년 12월 09일 12시 18분에 엘루이피자에서 한 말은 무엇인가요?,점심을 먹었다 사장님이 서비스를 줬다
2020-12-09,2022년 12월 09일 12시 18분에 엘루이피자에서 말했다 점심을 먹었다 사장님이 서비스를 줬다,2022년 12월 09일 12시 18분에 엘루이피자에서 어떤 감정을 느꼈나요?,사장님이 서비스를 줬다
2020-12-09,2022년 12월 09일 12시 18분에 엘루이피자에서 말했다 점심을 먹었다 사장님이 서비스를 줬다,점심을 먹었다 사장님이 서비스를 줬다를 말한 시간은 몇 시 인가요?,12시 18분
2020-12-09,2022년 12월 09일 12시 18분에 엘루이피자에서 말했다 점심을 먹었다 사장님이 서비스를 줬다,점심을 먹었다 사장님이 서비스를 줬다를 어떤 날짜에 말했나요?,44904
2020-12-09,2022년 12월 09일 15시 03분에 이돈집에서 말했다 가게 사장님이 대통령 표창장을 받았다 고기는 맛이 없었다,2022년 12월 09일 15시 03분에 이돈집에서 어떤 감정을 느꼈나요?,고기는 맛이 없었다
2020-12-09,2022년 12월 09일 15시 03분에 이돈집에서 말했다 가게 사장님이 대통령 표창장을 받았다 고기는 맛이 없었다,2022년 12월 09일 15시 03분에 이돈집에서 어떤 감정을 느꼈나요?,가게 사장님이 대통령 표창장을 받았다 고기는 맛이 없었다
2020-12-09,2022년 12월 09일 15시 03분에 이돈집에서 말했다 가게 사장님이 대통령 표창장을 받았다 고기는 맛이 없었다,2022년 12월 09일 15시 03분에 이돈집에서 무엇을 했나요?,가게 사장님이 대통령 표창장을 받았다
2020-12-09,2022년 12월 09일 15시 03분에 이돈집에서 말했다 가게 사장님이 대통령 표창장을 받았다 고기는 맛이 없었다,가게 사장님이 대통령 표창장을 받았다 고기는 맛이 없었다를 말한 장소는 어디인가요?,이돈
2020-12-09,2022년 12월 09일 15시 03분에 이돈집에서 말했다 가게 사장님이 대통령 표창장을 받았다 고기는 맛이 없었다,가게 사장님이 대통령 표창장을 받았다 고기는 맛이 없었다를 말한 시간은 몇 시 인가요?,15시 03분
2020-12-09,2022년 12월 09일 15시 03분에 이돈집에서 말했다 가게 사장님이 대통령 표창장을 받았다 고기는 맛이 없었다,대통령 표창장을 받았다 고기는 맛이 없었다를 어떤 날짜에 말했나요?,44904
2020-12-09,2022년 12월 09일 17시 24분에 맘스터치에서 말했다 재료값이 올랐나보다 와플 가격이 많이 올랐다,재료값이 올랐나보다 와플 가격이 많이 올랐다를 말한 시간은 몇 시 인가요?,17시 24분
2020-12-09,2022년 12월 09일 17시 24분에 맘스터치에서 말했다 재료값이 올랐나보다 와플 가격이 많이 올랐다,2022년 12월 09일 17시 24분에 맘스터치에서 어떤 감정을 느꼈나요?,와플 가격이 많이 올랐다
2020-12-09,2022년 12월 09일 17시 24분에 맘스터치에서 말했다 재료값이 올랐나보다 와플 가격이 많이 올랐다,2022년 12월 09일 17시 24분에 맘스터치에서 무엇을 했나요?,재료값이 올랐나보다
2020-12-09,2022년 12월 09일 17시 24분에 맘스터치에서 말했다 재료값이 올랐나보다 와플 가격이 많이 올랐다,재료값이 올랐나보다 와플 가격이 많이 올랐다를 말한 장소는 어디인가요?,맘스터치
2020-12-09,2022년 12월 09일 17시 24분에 맘스터치에서 말했다 재료값이 올랐나보다 와플 가격이 많이 올랐다,2022년 12월 09일 17시 24분에 맘스터치에서 한 말은 무엇인가요?,재료값이 올랐나보다 와플 가격이 많이 올랐다
2020-12-09,2022년 12월 09일 17시 24분에 맘스터치에서 말했다 재료값이 올랐나보다 와플 가격이 많이 올랐다,재료값이 올랐나보다 와플 가격이 많이 올랐다를 어떤 날짜에 말했나요?,44904
2020-12-09,2022년 12월 09일 04시 09분에 끄트머리집에서 말했다 준상이랑 고기를 먹었다 맛있었다,2022년 12월 09일 04시 09분에 끄트머리집에서 한 말은 무엇인가요?,준상이랑 고기를 먹었다 맛있었다
2020-12-09,2022년 12월 09일 04시 09분에 끄트머리집에서 말했다 준상이랑 고기를 먹었다 맛있었다,준상이랑 고기를 먹었다 맛있었다를 어떤 날짜에 말했나요?,44904
2020-12-09,2022년 12월 09일 04시 09분에 끄트머리집에서 말했다 준상이랑 고기를 먹었다 맛있었다,준상이랑 고기를 먹었다 맛있었다를 말한 시간은 몇 시 인가요?,04시 09분
2020-12-09,2022년 12월 09일 04시 09분에 끄트머리집에서 말했다 준상이랑 고기를 먹었다 맛있었다,준상이랑 고기를 먹었다 맛있었다를 말한 장소는 어디인가요?,끄트머리집
2020-12-09,2022년 12월 09일 04시 09분에 끄트머리집에서 말했다 준상이랑 고기를 먹었다 맛있었다,2022년 12월 09일 04시 09분에 끄트머리집에서 무엇을 했나요?,준상이랑 고기를 먹었다
2020-12-09,2022년 12월 09일 04시 09분에 끄트머리집에서 말했다 준상이랑 고기를 먹었다 맛있었다,2022년 12월 09일 04시 09분에 끄트머리집에서 어떤 감정을 느꼈나요?,맛있었다
2020-12-09,2022년 12월 09일 13시 13분에 설빙에서 말했다 석철이랑 제육볶음 먹었다 맛있었다,석철이랑 제육볶음 먹었다 맛있었다를 어떤 날짜에 말했나요?,44904
2020-12-09,2022년 12월 09일 13시 13분에 설빙에서 말했다 석철이랑 제육볶음 먹었다 맛있었다,2022년 12월 09일 13시 13분에 설빙에서 한 말은 무엇인가요?,석철이랑 제육볶음 먹었다 맛있었다
2020-12-09,2022년 12월 09일 13시 13분에 설빙에서 말했다 석철이랑 제육볶음 먹었다 맛있었다,2022년 12월 09일 13시 13분에 설빙에서 무엇을 했나요?,석철이랑 제육볶음 먹었다
2020-12-09,2022년 12월 09일 13시 13분에 설빙에서 말했다 석철이랑 제육볶음 먹었다 맛있었다,석철이랑 제육볶음 먹었다 맛있었다를 말한 장소는 어디인가요?,설빙
2020-12-09,2022년 12월 09일 13시 13분에 설빙에서 말했다 석철이랑 제육볶음 먹었다 맛있었다,석철이랑 제육볶음 먹었다 맛있었다를 말한 시간은 몇 시 인가요?,13시 13분
2020-12-09,2022년 12월 09일 13시 13분에 설빙에서 말했다 석철이랑 제육볶음 먹었다 맛있었다,2022년 12월 09일 13시 13분에 설빙에서 누구와 함께 행동했나요?,석철
2020-12-09,2022년 12월 09일 13시 13분에 설빙에서 말했다 석철이랑 제육볶음 먹었다 맛있었다,2022년 12월 09일 13시 13분에 설빙에서 어떤 감정을 느꼈나요?,맛있었다
2020-12-09,2022년 12월 09일 11시 00분에 ITBT관에서 말했다 딸기빙수를 먹었다 빙수 얼음이 녹았다,2022년 12월 09일 11시 00분에 ITBT관에서 어떤 감정을 느꼈나요?,빙수 얼음이 녹았다
2020-12-09,2022년 12월 09일 11시 00분에 ITBT관에서 말했다 딸기빙수를 먹었다 빙수 얼음이 녹았다,딸기빙수를 먹었다 빙수 얼음이 녹았다를 어떤 날짜에 말했나요?,44904
2020-12-09,2022년 12월 09일 11시 00분에 ITBT관에서 말했다 딸기빙수를 먹었다 빙수 얼음이 녹았다,2022년 12월 09일 11시 00분에 ITBT관에서 한 말은 무엇인가요?,딸기빙수를 먹었다 빙수 얼음이 녹았다
2020-12-09,2022년 12월 09일 11시 00분에 ITBT관에서 말했다 딸기빙수를 먹었다 빙수 얼음이 녹았다,2022년 12월 09일 11시 00분에 ITBT관에서 무엇을 했나요?,딸기빙수를 먹었다
2020-12-09,2022년 12월 09일 11시 00분에 ITBT관에서 말했다 딸기빙수를 먹었다 빙수 얼음이 녹았다,딸기빙수를 먹었다 빙수 얼음이 녹았다를 말한 장소는 어디인가요?,ITBT관
2020-12-09,2022년 12월 09일 11시 00분에 ITBT관에서 말했다 딸기빙수를 먹었다 빙수 얼음이 녹았다,딸기빙수를 먹었다 빙수 얼음이 녹았다를 말한 시간은 몇 시 인가요?,11시 00분
2020-12-09,2022년 12월 09일 05시 24분에 악어떡볶이에서 말했다 딸기와플을 먹었다 저렴하고 맛있었다,딸기와플을 먹었다 저렴하고 맛있었다를 말한 장소는 어디인가요?,악어떡볶이
2020-12-09,2022년 12월 09일 05시 24분에 악어떡볶이에서 말했다 딸기와플을 먹었다 저렴하고 맛있었다,딸기와플을 먹었다 저렴하고 맛있었다를 말한 시간은 몇 시 인가요?,05시 24분
2020-12-09,2022년 12월 09일 05시 24분에 악어떡볶이에서 말했다 딸기와플을 먹었다 저렴하고 맛있었다,2022년 12월 09일 05시 24분에 악어떡볶이에서 어떤 감정을 느꼈나요?,저렴하고 맛있었다
2020-12-09,2022년 12월 09일 05시 24분에 악어떡볶이에서 말했다 딸기와플을 먹었다 저렴하고 맛있었다,2022년 12월 09일 05시 24분에 악어떡볶이에서 한 말은 무엇인가요?,딸기와플을 먹었다 저렴하고 맛있었다
2020-12-09,2022년 12월 09일 05시 24분에 악어떡볶이에서 말했다 딸기와플을 먹었다 저렴하고 맛있었다,2022년 12월 09일 05시 24분에 악어떡볶이에서 무엇을 했나요?,딸기와플을 먹었다
2020-12-09,2022년 12월 09일 05시 24분에 악어떡볶이에서 말했다 딸기와플을 먹었다 저렴하고 맛있었다,딸기와플을 먹었다 저렴하고 맛있었다를 어떤 날짜에 말했나요?,44904
2022-12-10,2022년 12월 10일 05시 17분에 엘루이피자에서 말했다 제육볶음 먹었다 고기가 딱딱했다,2022년 12월 10일 05시 17분에 엘루이피자에서 무엇을 했나요?,제육볶음 먹었다
2022-12-10,2022년 12월 10일 05시 17분에 엘루이피자에서 말했다 제육볶음 먹었다 고기가 딱딱했다,제육볶음 먹었다 고기가 딱딱했다를 말한 장소는 어디인가요?,엘루이피자
2022-12-10,2022년 12월 10일 05시 17분에 엘루이피자에서 말했다 제육볶음 먹었다 고기가 딱딱했다,제육볶음 먹었다 고기가 딱딱했다를 말한 시간은 몇 시 인가요?,05시 17분
2022-12-10,2022년 12월 10일 05시 17분에 엘루이피자에서 말했다 제육볶음 먹었다 고기가 딱딱했다,제육볶음 먹었다 고기가 딱딱했다를 어떤 날짜에 말했나요?,44905
2022-12-10,2022년 12월 10일 05시 17분에 엘루이피자에서 말했다 제육볶음 먹었다 고기가 딱딱했다,2022년 12월 10일 05시 17분에 엘루이피자에서 한 말은 무엇인가요?,제육볶음 먹었다 고기가 딱딱했다
2022-12-10,2022년 12월 10일 05시 17분에 엘루이피자에서 말했다 제육볶음 먹었다 고기가 딱딱했다,2022년 12월 10일 05시 17분에 엘루이피자에서 어떤 감정을 느꼈나요?,고기가 딱딱했다
2022-12-10,2022년 12월 10일 12시 35분에 김부삼에서 말했다 가게 사장님이 대통령 표창장을 받았다 고기는 맛이 없었다,2022년 12월 10일 12시 35분에 김부삼에서 무엇을 했나요?,가게 사장님이 대통령 표창장을 받았다
2022-12-10,2022년 12월 10일 12시 35분에 김부삼에서 말했다 가게 사장님이 대통령 표창장을 받았다 고기는 맛이 없었다,사장님이 대통령 표창장을 받았다 고기는 맛이 없었다를 말한 시간은 몇 시 인가요?,12시 35분
2022-12-10,2022년 12월 10일 12시 35분에 김부삼에서 말했다 가게 사장님이 대통령 표창장을 받았다 고기는 맛이 없었다,가게 사장님이 대통령 표창장을 받았다 고기는 맛이 없었다를 말한 장소는 어디인가요?,김부삼
2022-12-10,2022년 12월 10일 12시 35분에 김부삼에서 말했다 가게 사장님이 대통령 표창장을 받았다 고기는 맛이 없었다,가게 사장님이 대통령 표창장을 받았다 고기는 맛이 없었다를 어떤 날짜에 말했나요?,44905
2022-12-10,2022년 12월 10일 12시 35분에 김부삼에서 말했다 가게 사장님이 대통령 표창장을 받았다 고기는 맛이 없었다,2022년 12월 10일 12시 35분에 김부삼에서 어떤 감정을 느꼈나요?,고기는 맛이 없었다
2022-12-10,2022년 12월 10일 12시 35분에 김부삼에서 말했다 가게 사장님이 대통령 표창장을 받았다 고기는 맛이 없었다,2022년 12월 10일 12시 35분에 김부삼에서 한 말은 무엇인가요?,가게 사장님이 대통령 표창장을 받았다 고기는 맛이 없었다
2022-12-10,2022년 12월 10일 10시 11분에 끄트머리집에서 말했다 석철이랑 제육볶음 먹었다 맛있었다,2022년 12월 10일 10시 11분에 끄트머리집에서 누구와 함께 행동했나요?,석철
2022-12-10,2022년 12월 10일 10시 11분에 끄트머리집에서 말했다 석철이랑 제육볶음 먹었다 맛있었다,2022년 12월 10일 10시 11분에 끄트머리집에서 무엇을 했나요?,석철이랑 제육볶음 먹었다
2022-12-10,2022년 12월 10일 10시 11분에 끄트머리집에서 말했다 석철이랑 제육볶음 먹었다 맛있었다,2022년 12월 10일 10시 11분에 끄트머리집에서 어떤 감정을 느꼈나요?,맛있었다
2022-12-10,2022년 12월 10일 10시 11분에 끄트머리집에서 말했다 석철이랑 제육볶음 먹었다 맛있었다,석철이랑 제육볶음 먹었다 맛있었다를 말한 장소는 어디인가요?,끄트머리집
2022-12-10,2022년 12월 10일 10시 11분에 끄트머리집에서 말했다 석철이랑 제육볶음 먹었다 맛있었다,석철이랑 제육볶음 먹었다 맛있었다를 말한 시간은 몇 시 인가요?,10시 11분
2022-12-10,2022년 12월 10일 10시 11분에 끄트머리집에서 말했다 석철이랑 제육볶음 먹었다 맛있었다,석철이랑 제육볶음 먹었다 맛있었다를 어떤 날짜에 말했나요?,44905
2022-12-10,2022년 12월 10일 10시 11분에 끄트머리집에서 말했다 석철이랑 제육볶음 먹었다 맛있었다,2022년 12월 10일 10시 11분에 끄트머리집에서 한 말은 무엇인가요?,석철이랑 제육볶음 먹었다 맛있었다
2022-12-10,2022년 12월 10일 00시 26분에 일락라멘에서 말했다 점심을 먹었다 사장님이 서비스를 줬다,2022년 12월 10일 00시 26분에 일락라멘에서 무엇을 했나요 ?,점심을 먹었다
2022-12-10,2022년 12월 10일 00시 26분에 일락라멘에서 말했다 점심을 먹었다 사장님이 서비스를 줬다,점심을 먹었다 사장님이 서비스를 줬다를 말한 장소는 어디인가요 ?,일락라멘
2022-12-10,2022년 12월 10일 00시 26분에 일락라멘에서 말했다 점심을 먹었다 사장님이 서비스를 줬다,2022년 12월 10일 00시 26분에 일락라멘에서 한 말은 무엇인가요 ?,점심을 먹었다 사장님이 서비스를 줬다
2022-12-10,2022년 12월 10일 00시 26분에 일락라멘에서 말했다 점심을 먹었다 사장님이 서비스를 줬다,점심을 먹었다 사장님이 서비스를 줬다를 말한 시간은 몇 시 인가요 ?,00시 26분
2022-12-10,2022년 12월 10일 00시 26분에 일락라멘에서 말했다 점심을 먹었다 사장님이 서비스를 줬다,점심을 먹었다 사장님이 서비스를 줬다를 어떤 날짜에 말했나요 ?,44905
2022-12-10,2022년 12월 10일 13시 23분에 철남에서 말했다 제육볶음 먹었다 고기가 딱딱했다,2022년 12월 10일 13시 23분에 철남에서 어떤 감정을 느꼈나요?,고기가 딱딱했다
2022-12-10,2022년 12월 10일 13시 23분에 철남에서 말했다 제육볶음 먹었다 고기가 딱딱했다,2022년 12월 10일 13시 23분에 철남에서 한 말은 무엇인가요?,제육볶음 먹었다 고기가 딱딱했다
2022-12-10,2022년 12월 10일 13시 23분에 철남에서 말했다 제육볶음 먹었다 고기가 딱딱했다,제육볶음 먹었다 고기가 딱딱했다를 어떤 날짜에 말했나요 ?,44905
2022-12-10,2022년 12월 10일 13시 23분에 철남에서 말했다 제육볶음 먹었다 고기가 딱딱했다,제육볶음 먹었다 고기가 딱딱했다를 말한 시간은 몇 시 인가요?,13시 23분
2022-12-10,2022년 12월 10일 13시 23분에 철남에서 말했다 제육볶음 먹었다 고기가 딱딱했다,제육볶음 먹었다 고기가 딱딱했다를 말한 장소는 어디인가요?,철남
2022-12-10,2022년 12월 10일 13시 23분에 철남에서 말했다 제육볶음 먹었다 고기가 딱딱했다,2022년 12월 10일 13시 23분에 철남에서 무엇을 했나요?,제육볶음 먹었다
2022-12-10,2022년 12월 10일 17시 14분에 엘루이피자에서 말했다 점심을 먹었다 사장님이 서비스를 줬다,점심을 먹었다 사장님이 서비스를 줬다를 어떤 날짜에 말했나요?,44905
2022-12-10,2022년 12월 10일 17시 14분에 엘루이피자에서 말했다 점심을 먹었다 사장님이 서비스를 줬다,점심을 먹었다 사장님이 서비스를 줬다를 말한 시간은 몇 시 인가요?,17시 14분
2022-12-10,2022년 12월 10일 17시 14분에 엘루이피자에서 말했다 점심을 먹었다 사장님이 서비스를 줬다,2022년 12월 10일 17시 14분에 엘루이피자에서 무엇을 했나요?,점심을 먹었다 
2022-12-10,2022년 12월 10일 17시 14분에 엘루이피자에서 말했다 점심을 먹었다 사장님이 서비스를 줬다,2022년 12월 10일 17시 14분에 엘루이피자에서 누구와 함께 행동했나요?,사장님
2022-12-10,2022년 12월 10일 17시 14분에 엘루이피자에서 말했다 점심을 먹었다 사장님이 서비스를 줬다,점심을 먹었다 사장님이 서비스를 줬다를 말한 장소는 어디인가요?,엘루이피자
2022-12-10,2022년 12월 10일 16시 22분에 은화수식당에서 말했다 가게 앞에서 귀여운 강아지를 봤다,가게 앞에서 귀여운 강아지를 봤다를 말한 장소는 어디인가요?,은화수식당
2022-12-10,2022년 12월 10일 16시 22분에 은화수식당에서 말했다 가게 앞에서 귀여운 강아지를 봤다,2022년 12월 10일 16시 22분에 은화수식당에서 한 말은 무엇인가요?,가게 앞에서 귀여운 강아지를 봤다
2022-12-10,2022년 12월 10일 16시 22분에 은화수식당에서 말했다 가게 앞에서 귀여운 강아지를 봤다,2022년 12월 10일 16시 22분에 은화수식당에서 무엇을 했나요?,가게 앞에서 귀여운 강아지를 봤다
2022-12-10,2022년 12월 10일 16시 22분에 은화수식당에서 말했다 가게 앞에서 귀여운 강아지를 봤다,가게 앞에서 귀여운 강아지를 봤다를 말한 시간은 몇 시 인가요?,16시 22분
2022-12-10,2022년 12월 10일 16시 22분에 은화수식당에서 말했다 가게 앞에서 귀여운 강아지를 봤다,가게 앞에서 귀여운 강아지를 봤다를 어떤 날짜에 말했나요?,44905
2022-12-11,2022년 12월 11일 07시 07분에 엘루이피자에서 말했다 왕십리에서 제일 저렴한 고기집이다 엄마 데러갈거다,2022년 12월 11일 07시 07분에 엘루이피자에서 한 말은 무엇인가요?,왕십리에서 제일 저렴한 고기집이다 엄마 데러갈거다
2022-12-11,2022년 12월 11일 07시 07분에 엘루이피자에서 말했다 왕십리에서 제일 저렴한 고기집이다 엄마 데러갈거다,2022년 12월 11일 07시 07분에 엘루이피자에서 어떤 감정을 느꼈나요?,엄마 데러갈거다
2022-12-11,2022년 12월 11일 07시 07분에 엘루이피자에서 말했다 왕십리에서 제일 저렴한 고기집이다 엄마 데러갈거다,왕십리에서 제일 저렴한 고기집이다 엄마 데러갈거다를 어떤 날짜에 말했나요?,44906
2022-12-11,2022년 12월 11일 07시 07분에 엘루이피자에서 말했다 왕십리에서 제일 저렴한 고기집이다 엄마 데러갈거다,왕십리에서 제일 저렴한 고기집이다 엄마 데러갈거다를 말한 시간은 몇 시 인가요?,07시 07분
2022-12-11,2022년 12월 11일 07시 07분에 엘루이피자에서 말했다 왕십리에서 제일 저렴한 고기집이다 엄마 데러갈거다,왕십리에서 제일 저렴한 고기집이다 엄마 데러갈거다를 말한 장소는 어디인가요?,엘루이피자
2022-12-11,2022년 12월 11일 07시 07분에 엘루이피자에서 말했다 왕십리에서 제일 저렴한 고기집이다 엄마 데러갈거다,2022년 12월 11일 07시 07분에 엘루이피자에서 무엇을 했나요?,왕십리에서 제일 저렴한 고기집이다
2022-12-11,2022년 12월 11일 23시 50분에 와플대학에서 말했다 오늘 교수님이 기분이 좋지 않은 듯 했다,2022년 12월 11일 23시 50분에 와플대학에서 무엇을 했나요?,오늘 교수님이 기분이 좋지 않은 듯 했다
2022-12-11,2022년 12월 11일 23시 50분에 와플대학에서 말했다 오늘 교수님이 기분이 좋지 않은 듯 했다,2022년 12월 11일 23시 50분에 와플대학에서 어떤 감정을 느꼈나요?,오늘 교수님이 기분이 좋지 않은 듯 했다
2022-12-11,2022년 12월 11일 23시 50분에 와플대학에서 말했다 오늘 교수님이 기분이 좋지 않은 듯 했다,2022년 12월 11일 23시 50분에 와플대학에서 한 말은 무엇인가요?,오늘 교수님이 기분이 좋지 않은 듯 했다
2022-12-11,2022년 12월 11일 23시 50분에 와플대학에서 말했다 오늘 교수님이 기분이 좋지 않은 듯 했다,오늘 교수님이 기분이 좋지 않은 듯 했다를 말한 장소는 어디인가요?,와플대학
2022-12-11,2022년 12월 11일 23시 50분에 와플대학에서 말했다 오늘 교수님이 기분이 좋지 않은 듯 했다,오늘 교수님이 기분이 좋지 않은 듯 했다를 어떤 날짜에 말했나요?,44906
2022-12-11,2022년 12월 11일 23시 50분에 와플대학에서 말했다 오늘 교수님이 기분이 좋지 않은 듯 했다,오늘 교수님이 기분이 좋지 않은 듯 했다를 말한 시간은 몇 시 인가요?,23시 50분
2022-12-11,2022년 12월 11일 12시 22분에 롤링파스타에서 말했다 바질파스타를 먹었다 파스타 면이 딱딱했다,2022년 12월 11일 12시 22분에 롤링파스타에서 어떤 감정을 느꼈나요?,파스타 면이 딱딱했다
2022-12-11,2022년 12월 11일 12시 22분에 롤링파스타에서 말했다 바질파스타를 먹었다 파스타 면이 딱딱했다,2022년 12월 11일 12시 22분에 롤링파스타에서 무엇을 했나요?,바질파스타를 먹었다
2022-12-11,2022년 12월 11일 12시 22분에 롤링파스타에서 말했다 바질파스타를 먹었다 파스타 면이 딱딱했다,바질파스타를 먹었다 파스타 면이 딱딱했다를 말한 장소는 어디인가요?,롤링파스타
2022-12-11,2022년 12월 11일 12시 22분에 롤링파스타에서 말했다 바질파스타를 먹었다 파스타 면이 딱딱했다,바질파스타를 먹었다 파스타 면이 딱딱했다를 말한 시간은 몇 시 인가요?,12시 22분
2022-12-11,2022년 12월 11일 12시 22분에 롤링파스타에서 말했다 바질파스타를 먹었다 파스타 면이 딱딱했다,바질파스타를 먹었다 파스타 면이 딱딱했다를 어떤 날짜에 말했나요?,44906
2022-12-11,2022년 12월 11일 12시 22분에 롤링파스타에서 말했다 바질파스타를 먹었다 파스타 면이 딱딱했다,2022년 12월 11일 12시 22분에 롤링파스타에서 한 말은 무엇인가요?,바질파스타를 먹었다 파스타 면이 딱딱했다
2022-12-11,2022년 12월 11일 05시 38분에 철남에서 말했다 제육볶음을 먹었다 양파가 많았다,제육볶음을 먹었다 양파가 많았다를 어떤 날짜에 말했나요?,44906
2022-12-11,2022년 12월 11일 05시 38분에 철남에서 말했다 제육볶음을 먹었다 양파가 많았다,제육볶음을 먹었다 양파가 많았다를 말한 시간은 몇 시 인가요?,05시 38분
2022-12-11,2022년 12월 11일 05시 38분에 철남에서 말했다 제육볶음을 먹었다 양파가 많았다,제육볶음을 먹었다 양파가 많았다를 말한 장소는 어디인가요?,철남
2022-12-11,2022년 12월 11일 05시 38분에 철남에서 말했다 제육볶음을 먹었다 양파가 많았다,2022년 12월 11일 05시 38분에 철남에서 한 말은 무엇인가요?,제육볶음을 먹었다 양파가 많았다
2022-12-11,2022년 12월 11일 05시 38분에 철남에서 말했다 제육볶음을 먹었다 양파가 많았다,2022년 12월 11일 05시 38분에 철남에서 어떤 감정을 느꼈나요?,양파가 많았다
2022-12-11,2022년 12월 11일 05시 38분에 철남에서 말했다 제육볶음을 먹었다 양파가 많았다,2022년 12월 11일 05시 38분에 철남에서 무엇을 했나요?,제육볶음을 먹었다
2022-12-11,2022년 12월 11일 22시 14분에 마쿠 마라탕에서 말했다 밥을 먹었다 지나가다가 세희를 만났다,2022년 12월 11일 22시 14분에 마쿠 마라탕에서 누구와 함께 행동했나요?,세희
2022-12-11,2022년 12월 11일 22시 14분에 마쿠 마라탕에서 말했다 밥을 먹었다 지나가다가 세희를 만났다,2022년 12월 11일 22시 14분에 마쿠 마라탕에서 한 말은 무엇인가요?,밥을 먹었다 지나가다가 세희를 만났다
2022-12-11,2022년 12월 11일 22시 14분에 마쿠 마라탕에서 말했다 밥을 먹었다 지나가다가 세희를 만났다,2022년 12월 11일 22시 14분에 마쿠 마라탕에서 무엇을 했나요?,밥을 먹었다 지나가다가 세희를 만났다
2022-12-11,2022년 12월 11일 22시 14분에 마쿠 마라탕에서 말했다 밥을 먹었다 지나가다가 세희를 만났다,밥을 먹었다 지나가다가 세희를 만났다를 말한 장소는 어디인가요?,마쿠 마라탕
2022-12-11,2022년 12월 11일 22시 14분에 마쿠 마라탕에서 말했다 밥을 먹었다 지나가다가 세희를 만났다,밥을 먹었다 지나가다가 세희를 만났다를 말한 시간은 몇 시 인가요?, 22시 14분
2022-12-11,2022년 12월 11일 22시 14분에 마쿠 마라탕에서 말했다 밥을 먹었다 지나가다가 세희를 만났다,밥을 먹었다 지나가다가 세희를 만났다를 어떤 날짜에 말했나요?,44906
2022-12-11,2022년 12월 11일 23시 25분에 힙덱에서 말했다 기본 와플을 시켰다 사장님이 서비스로 초코칩을 줬다,2022년 12월 11일 23시 25분에 힙덱에서 무엇을 했나요?,기본 와플을 시켰다
2022-12-11,2022년 12월 11일 23시 25분에 힙덱에서 말했다 기본 와플을 시켰다 사장님이 서비스로 초코칩을 줬다,기본 와플을 시켰다 사장님이 서비스로 초코칩을 줬다를 말한 장소는 어디인가요?,힙덱
2022-12-11,2022년 12월 11일 23시 25분에 힙덱에서 말했다 기본 와플을 시켰다 사장님이 서비스로 초코칩을 줬다,기본 와플을 시켰다 사장님이 서비스로 초코칩을 줬다를 말한 시간은 몇 시 인가요?,23시 25분
2022-12-11,2022년 12월 11일 23시 25분에 힙덱에서 말했다 기본 와플을 시켰다 사장님이 서비스로 초코칩을 줬다,기본 와플을 시켰다 사장님이 서비스로 초코칩을 줬다를 어떤 날짜에 말했나요?,44906
2022-12-11,2022년 12월 11일 23시 25분에 힙덱에서 말했다 기본 와플을 시켰다 사장님이 서비스로 초코칩을 줬다,2022년 12월 11일 23시 25분에 힙덱에서 한 말은 무엇인가요?,기본 와플을 시켰다 사장님이 서비스로 초코칩을 줬다
2022-12-11,2022년 12월 11일 23시 25분에 힙덱에서 말했다 기본 와플을 시켰다 사장님이 서비스로 초코칩을 줬다,2022년 12월 11일 23시 25분에 힙덱에서 어떤 감정을 느꼈나요?,사장님이 서비스로 초코칩을 줬다
2022-12-11,2022년 12월 11일 15시 01분에 띵똥와플에서 말했다 재료값이 올랐나보다 와플 가격이 많이 올랐다,2022년 12월 11일 15시 01분에 띵똥와플에서 어떤 감정을 느꼈나요?,와플 가격이 많이 올랐다
2022-12-11,2022년 12월 11일 15시 01분에 띵똥와플에서 말했다 재료값이 올랐나보다 와플 가격이 많이 올랐다,2022년 12월 11일 15시 01분에 띵똥와플에서 한 말은 무엇인가요?,재료값이 올랐나보다 와플 가격이 많이 올랐다
2022-12-11,2022년 12월 11일 15시 01분에 띵똥와플에서 말했다 재료값이 올랐나보다 와플 가격이 많이 올랐다,재료값이 올랐나보다 와플 가격이 많이 올랐다를 말한 장소는 어디인가요?,띵똥와플
2022-12-11,2022년 12월 11일 15시 01분에 띵똥와플에서 말했다 재료값이 올랐나보다 와플 가격이 많이 올랐다,재료값이 올랐나보다 와플 가격이 많이 올랐다를 말한 시간은 몇 시 인가요?,15시 01분
2022-12-11,2022년 12월 11일 15시 01분에 띵똥와플에서 말했다 재료값이 올랐나보다 와플 가격이 많이 올랐다,재료값이 올랐나보다 와플 가격이 많이 올랐다를 어떤 날짜에 말했나요?,44906
2022-12-12,2022년 12월 12일 14시 32분에 니캉내캉에서 말했다 계란찜을 먹었다 별로 맛이 없었다,2022년 12월 12일 14시 32분에 니캉내캉에서 어떤 감정을 느꼈나요?,별로 맛이 없었다
2022-12-12,2022년 12월 12일 14시 32분에 니캉내캉에서 말했다 계란찜을 먹었다 별로 맛이 없었다,계란찜을 먹었다 별로 맛이 없었다를 어떤 날짜에 말했나요?,44907
2022-12-12,2022년 12월 12일 14시 32분에 니캉내캉에서 말했다 계란찜을 먹었다 별로 맛이 없었다,2022년 12월 12일 14시 32분에 니캉내캉에서 무엇을 했나요?,계란찜을 먹었다
2022-12-12,2022년 12월 12일 14시 32분에 니캉내캉에서 말했다 계란찜을 먹었다 별로 맛이 없었다,계란찜을 먹었다 별로 맛이 없었다 말한 시간은 몇 시 인가요?,14시 32분
2022-12-12,2022년 12월 12일 14시 32분에 니캉내캉에서 말했다 계란찜을 먹었다 별로 맛이 없었다,계란찜을 먹었다 별로 맛이 없었다를 말한 장소는 어디인가요?,니캉내캉
2022-12-12,2022년 12월 12일 14시 32분에 니캉내캉에서 말했다 계란찜을 먹었다 별로 맛이 없었다,2022년 12월 12일 14시 32분에 니캉내캉에서 한 말은 무엇인가요?,계란찜을 먹었다 별로 맛이 없었다
2022-12-12,2022년 12월 12일 23시 44분에 띵똥와플에서 말했다 기본 와플을 시켰다 사장님이 서비스로 초코칩을 줬다,기본 와플을 시켰다 사장님이 서비스로 초코칩을 줬다를 말한 시간은 몇 시 인가요?,23시 44분
2022-12-12,2022년 12월 12일 23시 44분에 띵똥와플에서 말했다 기본 와플을 시켰다 사장님이 서비스로 초코칩을 줬다,기본 와플을 시켰다 사장님이 서비스로 초코칩을 줬다를 말한 장소는 어디인가요?, 띵똥와플
2022-12-12,2022년 12월 12일 23시 44분에 띵똥와플에서 말했다 기본 와플을 시켰다 사장님이 서비스로 초코칩을 줬다,2022년 12월 12일 23시 44분에 띵똥와플에서 무엇을 했나요?,기본 와플을 시켰다 
2022-12-12,2022년 12월 12일 23시 44분에 띵똥와플에서 말했다 기본 와플을 시켰다 사장님이 서비스로 초코칩을 줬다,2022년 12월 12일 23시 44분에 띵똥와플에서 누구와 함께 행동했나요?, 사장님
2022-12-12,2022년 12월 12일 23시 44분에 띵똥와플에서 말했다 기본 와플을 시켰다 사장님이 서비스로 초코칩을 줬다,2022년 12월 12일 23시 44분에 띵똥와플에서 한 말은 무엇인가요?,기본 와플을 시켰다 사장님이 서비스로 초코칩을 줬다
2022-12-12,2022년 12월 12일 23시 44분에 띵똥와플에서 말했다 기본 와플을 시켰다 사장님이 서비스로 초코칩을 줬다,기본 와플을 시켰다 사장님이 서비스로 초코칩을 줬다를 어떤 날짜에 말했나요?,44907
2022-12-12,2022년 12월 12일 06시 08분에 철남에서 말했다 민트초코빙수 새로 나와서 먹었다 내스타일이다,2022년 12월 12일 06시 08분에 철남에서 한 말은 무엇인가요?,민트초코빙수 새로 나와서 먹었다 내스타일이다
2022-12-12,2022년 12월 12일 06시 08분에 철남에서 말했다 민트초코빙수 새로 나와서 먹었다 내스타일이다,2022년 12월 12일 06시 08분에 철남에서 어떤 감정을 느꼈나요?,내스타일이다
2022-12-12,2022년 12월 12일 06시 08분에 철남에서 말했다 민트초코빙수 새로 나와서 먹었다 내스타일이다,민트초코빙수 새로 나와서 먹었다 내스타일이다를 말한 장소는 어디인가요?,철남
2022-12-12,2022년 12월 12일 06시 08분에 철남에서 말했다 민트초코빙수 새로 나와서 먹었다 내스타일이다,민트초코빙수 새로 나와서 먹었다 내스타일이다를 말한 시간은 몇 시 인가요?,06시 08분
2022-12-12,2022년 12월 12일 06시 08분에 철남에서 말했다 민트초코빙수 새로 나와서 먹었다 내스타일이다,민트초코빙수 새로 나와서 먹었다 내스타일이다를 어떤 날짜에 말했나요?,44907
2022-12-12,2022년 12월 12일 06시 08분에 철남에서 말했다 민트초코빙수 새로 나와서 먹었다 내스타일이다,2022년 12월 12일 06시 08분에 철남에서 무엇을 했나요?,민트초코빙수 새로 나와서 먹었다
2022-12-12,2022년 12월 12일 09시 10분에 낙원스낵에서 말했다 피자를 먹었다 이전보다 가격이 올라서 슬펐다,2022년 12월 12일 09시 10분에 낙원스낵에서 한 말은 무엇인가요?,피자를 먹었다 이전보다 가격이 올라서 슬펐다
2022-12-12,2022년 12월 12일 09시 10분에 낙원스낵에서 말했다 피자를 먹었다 이전보다 가격이 올라서 슬펐다,2022년 12월 12일 09시 10분에 낙원스낵에서 어떤 감정을 느꼈나요?,이전보다 가격이 올라서 슬펐다
2022-12-12,2022년 12월 12일 09시 10분에 낙원스낵에서 말했다 피자를 먹었다 이전보다 가격이 올라서 슬펐다,피자를 먹었다 이전보다 가격이 올라서 슬펐다를 어떤 날짜에 말했나요?,44907
2022-12-12,2022년 12월 12일 09시 10분에 낙원스낵에서 말했다 피자를 먹었다 이전보다 가격이 올라서 슬펐다,피자를 먹었다 이전보다 가격이 올라서 슬펐다를 말한 시간은 몇 시 인가요?,09시 10분
2022-12-12,2022년 12월 12일 09시 10분에 낙원스낵에서 말했다 피자를 먹었다 이전보다 가격이 올라서 슬펐다,피자를 먹었다 이전보다 가격이 올라서 슬펐다를 말한 장소는 어디인가요?,낙원스낵
2022-12-12,2022년 12월 12일 09시 10분에 낙원스낵에서 말했다 피자를 먹었다 이전보다 가격이 올라서 슬펐다,2022년 12월 12일 09시 10분에 낙원스낵에서 무엇을 했나요?,피자를 먹었다
2022-12-12,2022년 12월 12일 00시 09분에 죠스떡볶이에서 말했다 떡볶이를 먹었다 떡이 딱딱했다,2022년 12월 12일 00시 09분에 죠스떡볶이에서 한 말은 무엇인가요 ?,떡볶이를 먹었다 떡이 딱딱했다
2022-12-12,2022년 12월 12일 00시 09분에 죠스떡볶이에서 말했다 떡볶이를 먹었다 떡이 딱딱했다,2022년 12월 12일 00시 09분에 죠스떡볶이에서 어떤 감정을 느꼈나요 ?,떡이 딱딱했다
2022-12-12,2022년 12월 12일 00시 09분에 죠스떡볶이에서 말했다 떡볶이를 먹었다 떡이 딱딱했다,떡볶이를 먹었다 떡이 딱딱했다를 말한 장소는 어디인가요 ?,죠스떡볶이
2022-12-12,2022년 12월 12일 00시 09분에 죠스떡볶이에서 말했다 떡볶이를 먹었다 떡이 딱딱했다,"떡볶이를 먹었다 떡이 딱딱했다를 말한 시간은 몇 시 인가요 ?
", 00시 09분
2022-12-12,2022년 12월 12일 00시 09분에 죠스떡볶이에서 말했다 떡볶이를 먹었다 떡이 딱딱했다,떡볶이를 먹었다 떡이 딱딱했다를 어떤 날짜에 말했나요 ?,44907
2022-12-12,2022년 12월 12일 00시 09분에 죠스떡볶이에서 말했다 떡볶이를 먹었다 떡이 딱딱했다,2022년 12월 12일 00시 09분에 죠스떡볶이에서 무엇을 했나요 ?,떡볶이를 먹었다
2022-12-12,2022년 12월 12일 20시 05분에 육지고기에서 말했다 왕십리에서 제일 저렴한 고기집이다 엄마 데러갈거다,왕십리에서 제일 저렴한 고기집이다 엄마 데러갈거다를 말한 시간은 몇 시 인가요?,20시 05분
2022-12-12,2022년 12월 12일 20시 05분에 육지고기에서 말했다 왕십리에서 제일 저렴한 고기집이다 엄마 데러갈거다,왕십리에서 제일 저렴한 고기집이다 엄마 데러갈거다를 어떤 날짜에 말했나요?,44907
2022-12-12,2022년 12월 12일 20시 05분에 육지고기에서 말했다 왕십리에서 제일 저렴한 고기집이다 엄마 데러갈거다,왕십리에서 제일 저렴한 고기집이다 엄마 데러갈거다를 말한 장소는 어디인가요?,육지고기
2022-12-12,2022년 12월 12일 20시 05분에 육지고기에서 말했다 왕십리에서 제일 저렴한 고기집이다 엄마 데러갈거다,2022년 12월 12일 20시 05분에 육지고기에서 어떤 감정을 느꼈나요?,엄마 데러갈거다
2022-12-12,2022년 12월 12일 20시 05분에 육지고기에서 말했다 왕십리에서 제일 저렴한 고기집이다 엄마 데러갈거다,2022년 12월 12일 20시 05분에 육지고기에서 한 말은 무엇인가요?,왕십리에서 제일 저렴한 고기집이다 엄마 데러갈거다
2022-12-12,2022년 12월 12일 00시 07분에 띵똥와플에서 말했다 준상이랑 고기를 먹었다 맛있었다,준상이랑 고기를 먹었다 맛있었다를 말한 장소는 어디인가요?,띵똥와플
2022-12-12,2022년 12월 12일 00시 07분에 띵똥와플에서 말했다 준상이랑 고기를 먹었다 맛있었다,2022년 12월 12일 00시 07분에 띵똥와플에서 한 말은 무엇인가요?,준상이랑 고기를 먹었다 맛있었다
2022-12-12,2022년 12월 12일 00시 07분에 띵똥와플에서 말했다 준상이랑 고기를 먹었다 맛있었다,2022년 12월 12일 00시 07분에 띵똥와플에서 어떤 감정을 느꼈나요?,맛있었다
2022-12-12,2022년 12월 12일 00시 07분에 띵똥와플에서 말했다 준상이랑 고기를 먹었다 맛있었다,2022년 12월 12일 00시 07분에 띵똥와플에서 누구와 함께 행동했나요?,준상
2022-12-12,2022년 12월 12일 00시 07분에 띵똥와플에서 말했다 준상이랑 고기를 먹었다 맛있었다,2022년 12월 12일 00시 07분에 띵똥와플에서 무엇을 했나요?,준상이랑 고기를 먹었다
2022-12-12,2022년 12월 12일 00시 07분에 띵똥와플에서 말했다 준상이랑 고기를 먹었다 맛있었다,준상이랑 고기를 먹었다 맛있었다를 말한 시간은 몇 시 인가요?,00시 07분
2022-12-12,2022년 12월 12일 00시 07분에 띵똥와플에서 말했다 준상이랑 고기를 먹었다 맛있었다,준상이랑 고기를 먹었다 맛있었다를 어떤 날짜에 말했나요?,44907
2022-12-13,2022년 12월 13일 14시 34분에 공차에서 말했다 한양대점 버블티를 먹었다 알바생이 친절했다,2022년 12월 13일 14시 34분에 공차에서 한 말은 무엇인가요?,버블티를 먹었다 알바생이 친절했다
2022-12-13,2022년 12월 13일 14시 34분에 공차에서 말했다 한양대점 버블티를 먹었다 알바생이 친절했다,2022년 12월 13일 14시 34분에 공차에서 어떤 감정을 느꼈나요?,알바생이 친절했다
2022-12-13,2022년 12월 13일 14시 34분에 공차에서 말했다 한양대점 버블티를 먹었다 알바생이 친절했다,"한양대점 버블티를 먹었다 알바생이 친절했다를 말한 장소는 어디인가요?
",공차
2022-12-13,2022년 12월 13일 14시 34분에 공차에서 말했다 한양대점 버블티를 먹었다 알바생이 친절했다,"한양대점 버블티를 먹었다 알바생이 친절했다를 말한 시간은 몇 시 인가요?
",14시 34분
2022-12-13,2022년 12월 13일 14시 34분에 공차에서 말했다 한양대점 버블티를 먹었다 알바생이 친절했다,"한양대점 버블티를 먹었다 알바생이 친절했다를 어떤 날짜에 말했나요?
",44908
2022-12-13,2022년 12월 13일 14시 34분에 공차에서 말했다 한양대점 버블티를 먹었다 알바생이 친절했다,2022년 12월 13일 14시 34분에 공차에서 무엇을 했나요?,버블티를 먹었다
2022-12-13,2022년 12월 13일 14시 40분에 ITBT관에서 말했다 오늘 하늘이가 나한테 화냈다 무슨 일 때문이지,2022년 12월 13일 14시 40분에 ITBT관에서 한 말은 무엇인가요?,오늘 하늘이가 나한테 화냈다 무슨 일 때문이지
2022-12-13,2022년 12월 13일 14시 40분에 ITBT관에서 말했다 오늘 하늘이가 나한테 화냈다 무슨 일 때문이지,오늘 하늘이가 나한테 화냈다 무슨 일 때문이지를 말한 장소는 어디인가요?, ITBT관
2022-12-13,2022년 12월 13일 14시 40분에 ITBT관에서 말했다 오늘 하늘이가 나한테 화냈다 무슨 일 때문이지,2022년 12월 13일 14시 40분에 ITBT관에서 어떤 감정을 느꼈나요?,무슨 일 때문이지
2022-12-13,2022년 12월 13일 14시 40분에 ITBT관에서 말했다 오늘 하늘이가 나한테 화냈다 무슨 일 때문이지,오늘 하늘이가 나한테 화냈다 무슨 일 때문이지를 어떤 날짜에 말했나요?,44908
2022-12-13,2022년 12월 13일 14시 40분에 ITBT관에서 말했다 오늘 하늘이가 나한테 화냈다 무슨 일 때문이지,2022년 12월 13일 14시 40분에 ITBT관에서 무엇을 했나요?,오늘 하늘이가 나한테 화냈다
2022-12-13,2022년 12월 13일 14시 40분에 ITBT관에서 말했다 오늘 하늘이가 나한테 화냈다 무슨 일 때문이지,2022년 12월 13일 14시 40분에 ITBT관에서 누구와 함께 행동했나요?,하늘
2022-12-13,2022년 12월 13일 14시 40분에 ITBT관에서 말했다 오늘 하늘이가 나한테 화냈다 무슨 일 때문이지,오늘 하늘이가 나한테 화냈다 무슨 일 때문이지를 말한 시간은 몇 시 인가요?,14시 40분
2022-12-13,2022년 12월 13일 16시 09분에 철남에서 말했다 재료값이 올랐나보다 와플 가격이 많이 올랐다,2022년 12월 13일 16시 09분에 철남에서 한 말은 무엇인가요?,재료값이 올랐나보다 와플 가격이 많이 올랐다
2022-12-13,2022년 12월 13일 16시 09분에 철남에서 말했다 재료값이 올랐나보다 와플 가격이 많이 올랐다,2022년 12월 13일 16시 09분에 철남에서 어떤 감정을 느꼈나요?,와플 가격이 많이 올랐다
2022-12-13,2022년 12월 13일 16시 09분에 철남에서 말했다 재료값이 올랐나보다 와플 가격이 많이 올랐다,재료값이 올랐나보다 와플 가격이 많이 올랐다를 어떤 날짜에 말했나요?,44908
2022-12-13,2022년 12월 13일 16시 09분에 철남에서 말했다 재료값이 올랐나보다 와플 가격이 많이 올랐다,재료값이 올랐나보다 와플 가격이 많이 올랐다를 말한 시간은 몇 시 인가요?,16시 09분
2022-12-13,2022년 12월 13일 16시 09분에 철남에서 말했다 재료값이 올랐나보다 와플 가격이 많이 올랐다,재료값이 올랐나보다 와플 가격이 많이 올랐다를 말한 장소는 어디인가요?,철남
2022-12-13,2022년 12월 13일 16시 09분에 철남에서 말했다 재료값이 올랐나보다 와플 가격이 많이 올랐다,2022년 12월 13일 16시 09분에 철남에서 무엇을 했나요?,재료값이 올랐나보다
2022-12-13,2022년 12월 13일 23시 07분에 와플대학에서 말했다 한양대점 버블이 딱딱했다,2022년 12월 13일 23시 07분에 와플대학에서 한 말은 무엇인가요?,한양대점 버블이 딱딱했다
2022-12-13,2022년 12월 13일 23시 07분에 와플대학에서 말했다 한양대점 버블이 딱딱했다,한양대점 버블이 딱딱했다를 말한 시간은 몇 시 인가요?,23시 07분
2022-12-13,2022년 12월 13일 23시 07분에 와플대학에서 말했다 한양대점 버블이 딱딱했다,한양대점 버블이 딱딱했다를 어떤 날짜에 말했나요?,44908
2022-12-13,2022년 12월 13일 23시 07분에 와플대학에서 말했다 한양대점 버블이 딱딱했다,한양대점 버블이 딱딱했다를 말한 장소는 어디인가요?,와플대학
2022-12-13,2022년 12월 13일 23시 07분에 와플대학에서 말했다 한양대점 버블이 딱딱했다,2022년 12월 13일 23시 07분에 와플대학에서 어떤 감정을 느꼈나요?,한양대점 버블이 딱딱했다
2022-12-13,2022년 12월 13일 12시 39분에 설빙에서 말했다 계란찜을 먹었다 별로 맛이 없었다,2022년 12월 13일 12시 39분에 설빙에서 한 말은 무엇인가요?,계란찜을 먹었다 별로 맛이 없었다
2022-12-13,2022년 12월 13일 12시 39분에 설빙에서 말했다 계란찜을 먹었다 별로 맛이 없었다,2022년 12월 13일 12시 39분에 설빙에서 어떤 감정을 느꼈나요?,별로 맛이 없었다
2022-12-13,2022년 12월 13일 12시 39분에 설빙에서 말했다 계란찜을 먹었다 별로 맛이 없었다,2022년 12월 13일 12시 39분에 설빙에서 무엇을 했나요?,계란찜을 먹었다
2022-12-13,2022년 12월 13일 12시 39분에 설빙에서 말했다 계란찜을 먹었다 별로 맛이 없었다,계란찜을 먹었다 별로 맛이 없었다를 말한 장소는 어디인가요?,설빙
2022-12-13,2022년 12월 13일 12시 39분에 설빙에서 말했다 계란찜을 먹었다 별로 맛이 없었다,계란찜을 먹었다 별로 맛이 없었다를 말한 시간은 몇 시 인가요?, 12시 39분
2022-12-13,2022년 12월 13일 12시 39분에 설빙에서 말했다 계란찜을 먹었다 별로 맛이 없었다,계란찜을 먹었다 별로 맛이 없었다를 어떤 날짜에 말했나요?,44908
2022-12-13,2022년 12월 13일 06시 08분에 와플대학에서 말했다 오늘 교수님이 기분이 좋지 않은 듯 했다,2022년 12월 13일 06시 08분에 와플대학에서 어떤 감정을 느꼈나요?,교수님이 기분이 좋지 않은 듯 했다
2022-12-13,2022년 12월 13일 06시 08분에 와플대학에서 말했다 오늘 교수님이 기분이 좋지 않은 듯 했다,2022년 12월 13일 06시 08분에 와플대학에서 한 말은 무엇인가요?,오늘 교수님이 기분이 좋지 않은 듯 했다
2022-12-13,2022년 12월 13일 06시 08분에 와플대학에서 말했다 오늘 교수님이 기분이 좋지 않은 듯 했다,오늘 교수님이 기분이 좋지 않은 듯 했다를 말한 장소는 어디인가요?,와플대학
2022-12-13,2022년 12월 13일 06시 08분에 와플대학에서 말했다 오늘 교수님이 기분이 좋지 않은 듯 했다,오늘 교수님이 기분이 좋지 않은 듯 했다를 말한 시간은 몇 시 인가요?,06시 08분
2022-12-13,2022년 12월 13일 06시 08분에 와플대학에서 말했다 오늘 교수님이 기분이 좋지 않은 듯 했다,오늘 교수님이 기분이 좋지 않은 듯 했다를 어떤 날짜에 말했나요?,44908
2022-12-13,2022년 12월 13일 05시 25분에 설빙에서 말했다 가게 앞에서 귀여운 강아지를 봤다,2022년 12월 13일 05시 25분에 설빙에서 무엇을 했나요 ?,가게 앞에서 귀여운 강아지를 봤다
2022-12-13,2022년 12월 13일 05시 25분에 설빙에서 말했다 가게 앞에서 귀여운 강아지를 봤다,2022년 12월 13일 05시 25분에 설빙에서 한 말은 무엇인가요?,가게 앞에서 귀여운 강아지를 봤다
2022-12-13,2022년 12월 13일 05시 25분에 설빙에서 말했다 가게 앞에서 귀여운 강아지를 봤다,2022년 12월 13일 05시 25분에 설빙에서 어떤 감정을 느꼈나요?,귀여
2022-12-13,2022년 12월 13일 05시 25분에 설빙에서 말했다 가게 앞에서 귀여운 강아지를 봤다,가게 앞에서 귀여운 강아지를 봤다를 말한 시간은 몇 시 인가요 ?,05시 25분
2022-12-13,2022년 12월 13일 05시 25분에 설빙에서 말했다 가게 앞에서 귀여운 강아지를 봤다,가게 앞에서 귀여운 강아지를 봤다를 어떤 날짜에 말했나요 ?,44908
2022-12-13,2022년 12월 13일 05시 25분에 설빙에서 말했다 가게 앞에서 귀여운 강아지를 봤다,가게 앞에서 귀여운 강아지를 봤다를 말한 장소는 어디인가요 ?,설빙
2022-12-14,2022년 12월 14일 05시 12분에 ITBT관에서 말했다 왕십리에서 제일 저렴한 고기집이다 엄마 데러갈거다,2022년 12월 14일 05시 12분에 ITBT관에서 한 말은 무엇인가요?,왕십리에서 제일 저렴한 고기집이다 엄마 데러갈거다
2022-12-14,2022년 12월 14일 05시 12분에 ITBT관에서 말했다 왕십리에서 제일 저렴한 고기집이다 엄마 데러갈거다,2022년 12월 14일 05시 12분에 ITBT관에서 어떤 감정을 느꼈나요?,엄마 데러갈거다
2022-12-14,2022년 12월 14일 05시 12분에 ITBT관에서 말했다 왕십리에서 제일 저렴한 고기집이다 엄마 데러갈거다,2022년 12월 14일 05시 12분에 ITBT관에서 무엇을 했나요?,왕십리에서 제일 저렴한 고기집이다
2022-12-14,2022년 12월 14일 05시 12분에 ITBT관에서 말했다 왕십리에서 제일 저렴한 고기집이다 엄마 데러갈거다,왕십리에서 제일 저렴한 고기집이다 엄마 데러갈거다를 말한 장소는 어디인가요?,ITBT관
2022-12-14,2022년 12월 14일 05시 12분에 ITBT관에서 말했다 왕십리에서 제일 저렴한 고기집이다 엄마 데러갈거다,왕십리에서 제일 저렴한 고기집이다 엄마 데러갈거다를 말한 시간은 몇 시 인가요?,05시 12분
2022-12-14,2022년 12월 14일 05시 12분에 ITBT관에서 말했다 왕십리에서 제일 저렴한 고기집이다 엄마 데러갈거다,왕십리에서 제일 저렴한 고기집이다 엄마 데러갈거다를 어떤 날짜에 말했나요?,44909
2022-12-14,2021년 12월 14일 21시 56분에 은화수식당에서 말했다 왕십리 이마트에서 돈까스 세일한다 이따 가야겠다,2021년 12월 14일 21시 56분에 은화수식당에서 무엇을 했나요?,왕십리 이마트에서 돈까스 세일한다
2022-12-14,2021년 12월 14일 21시 56분에 은화수식당에서 말했다 왕십리 이마트에서 돈까스 세일한다 이따 가야겠다,2021년 12월 14일 21시 56분에 은화수식당에서 어떤 감정을 느꼈나요?,이따 가야겠다
2022-12-14,2021년 12월 14일 21시 56분에 은화수식당에서 말했다 왕십리 이마트에서 돈까스 세일한다 이따 가야겠다,2021년 12월 14일 21시 56분에 은화수식당에서 한 말은 무엇인가요?,왕십리 이마트에서 돈까스 세일한다 이따 가야겠다
2022-12-14,2021년 12월 14일 21시 56분에 은화수식당에서 말했다 왕십리 이마트에서 돈까스 세일한다 이따 가야겠다,왕십리 이마트에서 돈까스 세일한다 이따 가야겠다를 말한 장소는 어디인가요?,은화수식당
2022-12-14,2021년 12월 14일 21시 56분에 은화수식당에서 말했다 왕십리 이마트에서 돈까스 세일한다 이따 가야겠다,왕십리 이마트에서 돈까스 세일한다 이따 가야겠다를 말한 시간은 몇 시 인가요?, 21시 56분
2022-12-14,2021년 12월 14일 21시 56분에 은화수식당에서 말했다 왕십리 이마트에서 돈까스 세일한다 이따 가야겠다,왕십리 이마트에서 돈까스 세일한다 이따 가야겠다를 어떤 날짜에 말했나요?,2021년 12월 14일
2022-12-14,2022년 12월 14일 10시 12분에 니캉내캉에서 말했다 한양대점 버블티를 먹었다 알바생이 친절했다,2022년 12월 14일 10시 12분에 니캉내캉에서 어떤 감정을 느꼈나요?,알바생이 친절했다
2022-12-14,2022년 12월 14일 10시 12분에 니캉내캉에서 말했다 한양대점 버블티를 먹었다 알바생이 친절했다,2022년 12월 14일 10시 12분에 니캉내캉에서 한 말은 무엇인가요?,한양대점 버블티를 먹었다 알바생이 친절했다
2022-12-14,2022년 12월 14일 10시 12분에 니캉내캉에서 말했다 한양대점 버블티를 먹었다 알바생이 친절했다,한양대점 버블티를 먹었다 알바생이 친절했다를 말한 시간은 몇 시 인가요?,10시 12분
2022-12-14,2022년 12월 14일 10시 12분에 니캉내캉에서 말했다 한양대점 버블티를 먹었다 알바생이 친절했다,한양대점 버블티를 먹었다 알바생이 친절했다를 어떤 날짜에 말했나요?,44909
2022-12-14,2022년 12월 14일 10시 12분에 니캉내캉에서 말했다 한양대점 버블티를 먹었다 알바생이 친절했다,2022년 12월 14일 10시 12분에 니캉내캉에서 무엇을 했나요?,한양대점 버블티를 먹었다
2022-12-14,2022년 12월 14일 10시 12분에 니캉내캉에서 말했다 한양대점 버블티를 먹었다 알바생이 친절했다,한양대점 버블티를 먹었다 알바생이 친절했다를 말한 장소는 어디인가요?,니캉내캉
2022-12-14,2022년 12월 14일 06시 30분에 끄트머리집에서 말했다 딸기와플을 먹었다 저렴하고 맛있었다,2022년 12월 14일 06시 30분에 끄트머리집에서 한 말은 무엇인가요?,딸기와플을 먹었다 저렴하고 맛있었다
2022-12-14,2022년 12월 14일 06시 30분에 끄트머리집에서 말했다 딸기와플을 먹었다 저렴하고 맛있었다,2022년 12월 14일 06시 30분에 끄트머리집에서 어떤 감정을 느꼈나요?,저렴하고 맛있었다
2022-12-14,2022년 12월 14일 06시 30분에 끄트머리집에서 말했다 딸기와플을 먹었다 저렴하고 맛있었다,2022년 12월 14일 06시 30분에 끄트머리집에서 무엇을 했나요?,딸기와플을 먹었다
2022-12-14,2022년 12월 14일 06시 30분에 끄트머리집에서 말했다 딸기와플을 먹었다 저렴하고 맛있었다,딸기와플을 먹었다 저렴하고 맛있었다를 말한 장소는 어디인가요?,끄트머리집
2022-12-14,2022년 12월 14일 06시 30분에 끄트머리집에서 말했다 딸기와플을 먹었다 저렴하고 맛있었다,딸기와플을 먹었다 저렴하고 맛있었다를 말한 시간은 몇 시 인가요?,06시 30분
2022-12-14,2022년 12월 14일 06시 30분에 끄트머리집에서 말했다 딸기와플을 먹었다 저렴하고 맛있었다,딸기와플을 먹었다 저렴하고 맛있었다를 어떤 날짜에 말했나요?,44909
2022-12-14,2022년 12월 14일 00시 10분에 롤링파스타에서 말했다 크림 파스타를 먹었다 사장님이 친절하셨다,크림 파스타를 먹었다 사장님이 친절하셨다를 말한 장소는 어디인가요?,롤링파스타
2022-12-14,2022년 12월 14일 00시 10분에 롤링파스타에서 말했다 크림 파스타를 먹었다 사장님이 친절하셨다,크림 파스타를 먹었다 사장님이 친절하셨다를 말한 시간은 몇 시 인가요?,00시 10분
2022-12-14,2022년 12월 14일 00시 10분에 롤링파스타에서 말했다 크림 파스타를 먹었다 사장님이 친절하셨다,크림 파스타를 먹었다 사장님이 친절하셨다를 어떤 날짜에 말했나요?,44909
2022-12-14,2022년 12월 14일 00시 10분에 롤링파스타에서 말했다 크림 파스타를 먹었다 사장님이 친절하셨다,2022년 12월 14일 00시 10분에 롤링파스타에서 어떤 감정을 느꼈나요?,사장님이 친절하셨다
2022-12-14,2022년 12월 14일 00시 10분에 롤링파스타에서 말했다 크림 파스타를 먹었다 사장님이 친절하셨다,2022년 12월 14일 00시 10분에 롤링파스타에서 한 말은 무엇인가요?,크림 파스타를 먹었다 사장님이 친절하셨다
2022-12-14,2022년 12월 14일 00시 10분에 롤링파스타에서 말했다 크림 파스타를 먹었다 사장님이 친절하셨다,2022년 12월 14일 00시 10분에 롤링파스타에서 무엇을 했나요?,크림 파스타를 먹었다
2022-12-14,2022년 12월 14일 15시 48분에 니캉내캉에서 말했다 준상이랑 고기를 먹었다 맛있었다,준상이랑 고기를 먹었다 맛있었다를 어떤 날짜에 말했나요?,44909
2022-12-14,2022년 12월 14일 15시 48분에 니캉내캉에서 말했다 준상이랑 고기를 먹었다 맛있었다,2022년 12월 14일 15시 48분에 니캉내캉에서 어떤 감정을 느꼈나요?,맛있었다
2022-12-14,2022년 12월 14일 15시 48분에 니캉내캉에서 말했다 준상이랑 고기를 먹었다 맛있었다,준상이랑 고기를 먹었다 맛있었다를 말한 장소는 어디인가요?,니캉내캉
2022-12-14,2022년 12월 14일 15시 48분에 니캉내캉에서 말했다 준상이랑 고기를 먹었다 맛있었다,2022년 12월 14일 15시 48분에 니캉내캉에서 무엇을 했나요?,준상이랑 고기를 먹었다
2022-12-14,2022년 12월 14일 15시 48분에 니캉내캉에서 말했다 준상이랑 고기를 먹었다 맛있었다,2022년 12월 14일 15시 48분에 니캉내캉에서 누구와 함께 행동했나요?,준상
2022-12-14,2022년 12월 14일 15시 48분에 니캉내캉에서 말했다 준상이랑 고기를 먹었다 맛있었다,2022년 12월 14일 15시 48분에 니캉내캉에서 한 말은 무엇인가요?,준상이랑 고기를 먹었다 맛있었다
2022-12-14,2022년 12월 14일 15시 48분에 니캉내캉에서 말했다 준상이랑 고기를 먹었다 맛있었다,준상이랑 고기를 먹었다 맛있었다를 말한 시간은 몇 시 인가요?,15시 48분
2022-12-14,2022년 12월 14일 18시 01분에 롤링파스타에서 말했다 딸기와플을 먹었다 저렴하고 맛있었다,딸기와플을 먹었다 저렴하고 맛있었다를 어떤 날짜에 말했나요?,44909
2022-12-14,2022년 12월 14일 18시 01분에 롤링파스타에서 말했다 딸기와플을 먹었다 저렴하고 맛있었다,딸기와플을 먹었다 저렴하고 맛있었다를 말한 시간은 몇 시 인가요?,18시 01분
2022-12-14,2022년 12월 14일 18시 01분에 롤링파스타에서 말했다 딸기와플을 먹었다 저렴하고 맛있었다,2022년 12월 14일 18시 01분에 롤링파스타에서 무엇을 했나요?,딸기와플을 먹었다
2022-12-14,2022년 12월 14일 18시 01분에 롤링파스타에서 말했다 딸기와플을 먹었다 저렴하고 맛있었다,2022년 12월 14일 18시 01분에 롤링파스타에서 한 말은 무엇인가요?,딸기와플을 먹었다 저렴하고 맛있었다
2022-12-14,2022년 12월 14일 18시 01분에 롤링파스타에서 말했다 딸기와플을 먹었다 저렴하고 맛있었다,2022년 12월 14일 18시 01분에 롤링파스타에서 어떤 감정을 느꼈나요?,저렴하고 맛있었다
2022-12-14,2022년 12월 14일 18시 01분에 롤링파스타에서 말했다 딸기와플을 먹었다 저렴하고 맛있었다,딸기와플을 먹었다 저렴하고 맛있었다를 말한 장소는 어디인가요?,롤링파스타
2022-12-15,2022년 12월 15일 06시 33분에 공차에서 말했다 한양대점 버블이 딱딱했다,한양대점 버블이 딱딱했다를 말한 장소는 어디인가요 ?,공차
2022-12-15,2022년 12월 15일 06시 33분에 공차에서 말했다 한양대점 버블이 딱딱했다,한양대점 버블이 딱딱했다를 말한 시간은 몇 시 인가요 ?,06시 33분
2022-12-15,2022년 12월 15일 06시 33분에 공차에서 말했다 한양대점 버블이 딱딱했다,한양대점 버블이 딱딱했다를 어떤 날짜에 말했나요 ?,44909
2022-12-15,2022년 12월 15일 06시 33분에 공차에서 말했다 한양대점 버블이 딱딱했다,2022년 12월 14일 06시 33분에 공차에서 한 말은 무엇인가요 ?,한양대점 버블이 딱딱했다
2022-12-15,2022년 12월 15일 09시 40분에 김부삼에서 말했다 시간 웨이팅하고 마라탕을 먹었다 사장님이 친절하셨다,2022년 12월 14일 09시 40분에 김부삼에서 어떤 감정을 느꼈나요?,사장님이 친절하셨다
2022-12-15,2022년 12월 15일 09시 40분에 김부삼에서 말했다 시간 웨이팅하고 마라탕을 먹었다 사장님이 친절하셨다,시간 웨이팅하고 마라탕을 먹었다 사장님이 친절하셨다를 어떤 날짜에 말했나요?,44909
2022-12-15,2022년 12월 15일 09시 40분에 김부삼에서 말했다 시간 웨이팅하고 마라탕을 먹었다 사장님이 친절하셨다,시간 웨이팅하고 마라탕을 먹었다 사장님이 친절하셨다를 말한 시간은 몇 시 인가요?,09시 40분
2022-12-15,2022년 12월 15일 09시 40분에 김부삼에서 말했다 시간 웨이팅하고 마라탕을 먹었다 사장님이 친절하셨다,시간 웨이팅하고 마라탕을 먹었다 사장님이 친절하셨다를 말한 장소는 어디인가요?,김부삼
2022-12-15,2022년 12월 15일 09시 40분에 김부삼에서 말했다 시간 웨이팅하고 마라탕을 먹었다 사장님이 친절하셨다,2022년 12월 14일 09시 40분에 김부삼에서 무엇을 했나요?,간 웨이팅하고 마라탕을 먹었다
2022-12-15,2022년 12월 15일 09시 40분에 김부삼에서 말했다 시간 웨이팅하고 마라탕을 먹었다 사장님이 친절하셨다,2022년 12월 14일 09시 40분에 김부삼에서 한 말은 무엇인가요?,시간 웨이팅하고 마라탕을 먹었다 사장님이 친절하셨다
2022-12-15,2022년 12월 15일 11시 38분에 철남에서 말했다 왕십리 이마트에서 돈까스 세일한다 이따 가야겠다,왕십리 이마트에서 돈까스 세일한다 이따 가야겠다를 말한 장소는 어디인가요?,철남
2022-12-15,2022년 12월 15일 11시 38분에 철남에서 말했다 왕십리 이마트에서 돈까스 세일한다 이따 가야겠다,2022년 12월 15일 11시 38분에 철남에서 무엇을 했나요?,십리 이마트에서 돈까스 세일한다
2022-12-15,2022년 12월 15일 11시 38분에 철남에서 말했다 왕십리 이마트에서 돈까스 세일한다 이따 가야겠다,2022년 12월 15일 11시 38분에 철남에서 어떤 감정을 느꼈나요?,이따 가야겠다
2022-12-15,2022년 12월 15일 11시 38분에 철남에서 말했다 왕십리 이마트에서 돈까스 세일한다 이따 가야겠다,왕십리 이마트에서 돈까스 세일한다 이따 가야겠다를 말한 시간은 몇 시 인가요?,11시 38분
2022-12-15,2022년 12월 15일 11시 38분에 철남에서 말했다 왕십리 이마트에서 돈까스 세일한다 이따 가야겠다,왕십리 이마트에서 돈까스 세일한다 이따 가야겠다를 어떤 날짜에 말했나요?,44910
2022-12-15,2022년 12월 15일 17시 46분에 엘루이피자에서 말했다 피자를 먹었다 이전보다 가격이 올라서 슬펐다,피자를 먹었다 이전보다 가격이 올라서 슬펐다를 어떤 날짜에 말했나요 ?,44910
2022-12-15,2022년 12월 15일 17시 46분에 엘루이피자에서 말했다 피자를 먹었다 이전보다 가격이 올라서 슬펐다,2022년 12월 15일 17시 46분에 엘루이피자에서 한 말은 무엇인가요 ?,피자를 먹었다 이전보다 가격이 올라서 슬펐다
2022-12-15,2022년 12월 15일 17시 46분에 엘루이피자에서 말했다 피자를 먹었다 이전보다 가격이 올라서 슬펐다,2022년 12월 15일 17시 46분에 엘루이피자에서 어떤 감정을 느꼈나요 ?,슬펐다
2022-12-15,2022년 12월 15일 17시 46분에 엘루이피자에서 말했다 피자를 먹었다 이전보다 가격이 올라서 슬펐다,피자를 먹었다 이전보다 가격이 올라서 슬펐다를 말한 장소는 어디인가요 ?,엘루이피자
2022-12-15,2022년 12월 15일 17시 46분에 엘루이피자에서 말했다 피자를 먹었다 이전보다 가격이 올라서 슬펐다,2022년 12월 15일 17시 46분에 엘루이피자에서 무엇을 했나요 ?,피자를 먹었다
2022-12-15,2022년 12월 15일 17시 46분에 엘루이피자에서 말했다 피자를 먹었다 이전보다 가격이 올라서 슬펐다,피자를 먹었다 이전보다 가격이 올라서 슬펐다를 말한 시간은 몇 시 인가요 ?,17시 46분
2022-12-15,2022년 12월 15일 21시 33분에 끄트머리집에서 말했다 모르는 사람이랑 밥 먹었다 재미있었다,모르는 사람이랑 밥 먹었다 재미있었다를 어떤 날짜에 말했나요?,44910
2022-12-15,2022년 12월 15일 21시 33분에 끄트머리집에서 말했다 모르는 사람이랑 밥 먹었다 재미있었다,2022년 12월 15일 21시 33분에 끄트머리집에서 한 말은 무엇인가요?,모르는 사람이랑 밥 먹었다 재미있었다
2022-12-15,2022년 12월 15일 21시 33분에 끄트머리집에서 말했다 모르는 사람이랑 밥 먹었다 재미있었다,모르는 사람이랑 밥 먹었다 재미있었다를 말한 시간은 언제인가요?,21시 33분
2022-12-15,2022년 12월 15일 21시 33분에 끄트머리집에서 말했다 모르는 사람이랑 밥 먹었다 재미있었다,모르는 사람이랑 밥 먹었다 재미있었다를 말한 장소는 어디인가요?,끄트머리집
2022-12-15,2022년 12월 15일 21시 33분에 끄트머리집에서 말했다 모르는 사람이랑 밥 먹었다 재미있었다,2022년 12월 15일 21시 33분에 끄트머리집에서 누구와 함께 행동했나요?,모르는 사람
2022-12-15,2022년 12월 15일 21시 33분에 끄트머리집에서 말했다 모르는 사람이랑 밥 먹었다 재미있었다,2022년 12월 15일 21시 33분에 끄트머리집에서 어떤 감정을 느꼈나요?,재미있었다
2022-12-15,2022년 12월 15일 21시 33분에 끄트머리집에서 말했다 모르는 사람이랑 밥 먹었다 재미있었다,2022년 12월 15일 21시 33분에 끄트머리집에서 무엇을 했나요?,밥 먹었다 
2022-12-15,2022년 12월 15일 09시 50분에 싱싱오징어바다에서 말했다 가게 앞에서 귀여운 강아지를 봤다,가게 앞에서 귀여운 강아지를 봤다를 말한 시간은 몇 시 인가요?,09시 50분
2022-12-15,2022년 12월 15일 09시 50분에 싱싱오징어바다에서 말했다 가게 앞에서 귀여운 강아지를 봤다,가게 앞에서 귀여운 강아지를 봤다를 어떤 날짜에 말했나요?,44910
2022-12-15,2022년 12월 15일 09시 50분에 싱싱오징어바다에서 말했다 가게 앞에서 귀여운 강아지를 봤다,2022년 12월 15일 09시 50분에 싱싱오징어바다에서 한 말은 무엇인가요?,가게 앞에서 귀여운 강아지를 봤다
2022-12-15,2022년 12월 15일 09시 50분에 싱싱오징어바다에서 말했다 가게 앞에서 귀여운 강아지를 봤다,2022년 12월 15일 09시 50분에 싱싱오징어바다에서 무엇을 했나요?,귀여운 강아지를 봤다
2022-12-15,2022년 12월 15일 09시 50분에 싱싱오징어바다에서 말했다 가게 앞에서 귀여운 강아지를 봤다,가게 앞에서 귀여운 강아지를 봤다를 말한 장소는 어디인가요?,싱싱오징어바다
2022-12-15,2022년 12월 15일 19시 48분에 한양대학교에서 말했다 동기모임을 했다 오랜만에 친구를 만나서 좋았다,2022년 12월 15일 19시 48분에 한양대학교에서 한 말은 무엇인가요?,동기모임을 했다 오랜만에 친구를 만나서 좋았다
2022-12-15,2022년 12월 15일 19시 48분에 한양대학교에서 말했다 동기모임을 했다 오랜만에 친구를 만나서 좋았다,동기모임을 했다 오랜만에 친구를 만나서 좋았다를 말한 장소는 어디인가요?,한양대학교
2022-12-15,2022년 12월 15일 19시 48분에 한양대학교에서 말했다 동기모임을 했다 오랜만에 친구를 만나서 좋았다,2022년 12월 15일 19시 48분에 한양대학교에서 어떤 감정을 느꼈나요?,오랜만에 친구를 만나서 좋았다
2022-12-15,2022년 12월 15일 19시 48분에 한양대학교에서 말했다 동기모임을 했다 오랜만에 친구를 만나서 좋았다,동기모임을 했다 오랜만에 친구를 만나서 좋았다를 말한 시간은 몇 시 인가요?,19시 48분
2022-12-15,2022년 12월 15일 19시 48분에 한양대학교에서 말했다 동기모임을 했다 오랜만에 친구를 만나서 좋았다,동기모임을 했다 오랜만에 친구를 만나서 좋았다를 어떤 날짜에 말했나요?,44910
2022-12-15,2022년 12월 15일 19시 48분에 한양대학교에서 말했다 동기모임을 했다 오랜만에 친구를 만나서 좋았다,2022년 12월 15일 19시 48분에 한양대학교에서 무엇을 했나요?,동기모임을 했다
2022-12-16,2022년 12월 16일 02시 20분에 설빙에서 말했다 민트초코빙수 새로 나와서 먹었다 내스타일이다,2022년 12월 16일 02시 20분에 설빙에서 한 말은 무엇인가요?,민트초코빙수 새로 나와서 먹었다 내스타일이다
2022-12-16,2022년 12월 16일 02시 20분에 설빙에서 말했다 민트초코빙수 새로 나와서 먹었다 내스타일이다,2022년 12월 16일 02시 20분에 설빙에서 어떤 감정을 느꼈나요?,내스타일이다
2022-12-16,2022년 12월 16일 02시 20분에 설빙에서 말했다 민트초코빙수 새로 나와서 먹었다 내스타일이다,민트초코빙수 새로 나와서 먹었다 내스타일이다를 어떤 날짜에 말했나요?,44911
2022-12-16,2022년 12월 16일 02시 20분에 설빙에서 말했다 민트초코빙수 새로 나와서 먹었다 내스타일이다,민트초코빙수 새로 나와서 먹었다 내스타일이다를 말한 시간은 몇 시 인가요?,02시 20
2022-12-16,2022년 12월 16일 02시 20분에 설빙에서 말했다 민트초코빙수 새로 나와서 먹었다 내스타일이다,2022년 12월 16일 02시 20분에 설빙에서 무엇을 했나요?,민트초코빙수 새로 나와서 먹었다
2022-12-16,2022년 12월 16일 02시 20분에 설빙에서 말했다 민트초코빙수 새로 나와서 먹었다 내스타일이다,민트초코빙수 새로 나와서 먹었다 내스타일이다를 말한 장소는 어디인가요?,설빙
2022-12-16,2022년 12월 16일 22시 08분에 죠스떡볶이에서 말했다 가게 사장님이 대통령 표창장을 받았다 고기는 맛이 없었다,2022년 12월 16일 22시 08분에 죠스떡볶이에서 무엇을 했나요?,가게 사장님이 대통령 표창장을 받았다
2022-12-16,2022년 12월 16일 22시 08분에 죠스떡볶이에서 말했다 가게 사장님이 대통령 표창장을 받았다 고기는 맛이 없었다,가게 사장님이 대통령 표창장을 받았다 고기는 맛이 없었다를 말한 시간은 몇 시 인가요?,22시 08분
2022-12-16,2022년 12월 16일 22시 08분에 죠스떡볶이에서 말했다 가게 사장님이 대통령 표창장을 받았다 고기는 맛이 없었다,가게 사장님이 대통령 표창장을 받았다 고기는 맛이 없었다를 어떤 날짜에 말했나요?,44911
2022-12-16,2022년 12월 16일 22시 08분에 죠스떡볶이에서 말했다 가게 사장님이 대통령 표창장을 받았다 고기는 맛이 없었다,가게 사장님이 대통령 표창장을 받았다 고기는 맛이 없었다를 말한 장소는 어디인가요?,죠스떡볶이
2022-12-16,2022년 12월 16일 22시 08분에 죠스떡볶이에서 말했다 가게 사장님이 대통령 표창장을 받았다 고기는 맛이 없었다,2022년 12월 16일 22시 08분에 죠스떡볶이에서 한 말은 무엇인가요?,가게 사장님이 대통령 표창장을 받았다 고기는 맛이 없었다
2022-12-16,2022년 12월 16일 22시 08분에 죠스떡볶이에서 말했다 가게 사장님이 대통령 표창장을 받았다 고기는 맛이 없었다,2022년 12월 16일 22시 08분에 죠스떡볶이에서 어떤 감정을 느꼈나요?,고기는 맛이 없었다
2022-12-16,2022년 12월 16일 08시 39분에 끄트머리집에서 말했다 고기를 먹었는데 오늘은 맛이 없었다,고기를 먹었는데 오늘은 맛이 없었다를 말한 장소는 어디인가요?,끄트머리집
2022-12-16,2022년 12월 16일 08시 39분에 끄트머리집에서 말했다 고기를 먹었는데 오늘은 맛이 없었다,고기를 먹었는데 오늘은 맛이 없었다를 말한 시간은 몇 시 인가요?,08시 39분
2022-12-16,2022년 12월 16일 08시 39분에 끄트머리집에서 말했다 고기를 먹었는데 오늘은 맛이 없었다,2022년 12월 16일 08시 39분에 끄트머리집에서 무엇을 했나요?,고기를 먹었는데
2022-12-16,2022년 12월 16일 08시 39분에 끄트머리집에서 말했다 고기를 먹었는데 오늘은 맛이 없었다,2022년 12월 16일 08시 39분에 끄트머리집에서 어떤 감정을 느꼈나요?,오늘은 맛이 없었다
2022-12-16,2022년 12월 16일 08시 39분에 끄트머리집에서 말했다 고기를 먹었는데 오늘은 맛이 없었다,기를 먹었는데 오늘은 맛이 없었다를 어떤 날짜에 말했나요?,44911
2022-12-16,2022년 12월 16일 08시 39분에 끄트머리집에서 말했다 고기를 먹었는데 오늘은 맛이 없었다,2022년 12월 16일 08시 39분에 끄트머리집에서 한 말은 무엇인가요?,고기를 먹었는데 오늘은 맛이 없었다
2022-12-16,2022년 12월 16일 05시 09분에 맘스터치에서 말했다 싸이버거를 먹었다 치킨이 맛있었다,싸이버거를 먹었다 치킨이 맛있었다를 말한 장소는 어디인가요?,맘스터치
2022-12-16,2022년 12월 16일 05시 09분에 맘스터치에서 말했다 싸이버거를 먹었다 치킨이 맛있었다,싸이버거를 먹었다 치킨이 맛있었다를 말한 시간은 몇 시 인가요?, 05시 09분
2022-12-16,2022년 12월 16일 05시 09분에 맘스터치에서 말했다 싸이버거를 먹었다 치킨이 맛있었다,싸이버거를 먹었다 치킨이 맛있었다를 어떤 날짜에 말했나요?,44911
2022-12-16,2022년 12월 16일 05시 09분에 맘스터치에서 말했다 싸이버거를 먹었다 치킨이 맛있었다,2022년 12월 16일 05시 09분에 맘스터치에서 무엇을 했나요?,싸이버거를 먹었다 
2022-12-16,2022년 12월 16일 05시 09분에 맘스터치에서 말했다 싸이버거를 먹었다 치킨이 맛있었다,2022년 12월 16일 05시 09분에 맘스터치에서 어떤 감정을 느꼈나요?,치킨이 맛있었다
2022-12-16,2022년 12월 16일 05시 09분에 맘스터치에서 말했다 싸이버거를 먹었다 치킨이 맛있었다,2022년 12월 16일 05시 09분에 맘스터치에서 한 말은 무엇인가요?,싸이버거를 먹었다 치킨이 맛있었다
2022-12-16,2022년 12월 16일 13시 47분에 싱싱오징어바다에서 말했다 제육볶음 먹었다 고기가 딱딱했다,제육볶음 먹었다 고기가 딱딱했다를 어떤 날짜에 말했나요?,44911
2022-12-16,2022년 12월 16일 13시 47분에 싱싱오징어바다에서 말했다 제육볶음 먹었다 고기가 딱딱했다,2022년 12월 16일 13시 47분에 싱싱오징어바다에서 한 말은 무엇인가요?,제육볶음 먹었다 고기가 딱딱했다
2022-12-16,2022년 12월 16일 13시 47분에 싱싱오징어바다에서 말했다 제육볶음 먹었다 고기가 딱딱했다,제육볶음 먹었다 고기가 딱딱했다를 말한 시간은 몇 시 인가요?, 13시 47분
2022-12-16,2022년 12월 16일 13시 47분에 싱싱오징어바다에서 말했다 제육볶음 먹었다 고기가 딱딱했다,2022년 12월 16일 13시 47분에 싱싱오징어바다에서 어떤 감정을 느꼈나요?,고기가 딱딱했다
2022-12-16,2022년 12월 16일 13시 47분에 싱싱오징어바다에서 말했다 제육볶음 먹었다 고기가 딱딱했다,2022년 12월 16일 13시 47분에 싱싱오징어바다에서 무엇을 했나요?,제육볶음 먹었다
2022-12-16,2022년 12월 16일 13시 47분에 싱싱오징어바다에서 말했다 제육볶음 먹었다 고기가 딱딱했다,제육볶음 먹었다 고기가 딱딱했다를 말한 장소는 어디인가요?,싱싱오징어바다
2022-12-16,2022년 12월 16일 20시 55분에 띵똥와플에서 말했다 딸기빙수를 먹었다 빙수 얼음이 녹았다,2022년 12월 16일 20시 55분에 띵똥와플에서 무엇을 했나요?,딸기빙수를 먹었다
2022-12-16,2022년 12월 16일 20시 55분에 띵똥와플에서 말했다 딸기빙수를 먹었다 빙수 얼음이 녹았다,딸기빙수를 먹었다 빙수 얼음이 녹았다를 말한 시간은 몇 시 인가요?,20시 55분
2022-12-16,2022년 12월 16일 20시 55분에 띵똥와플에서 말했다 딸기빙수를 먹었다 빙수 얼음이 녹았다,딸기빙수를 먹었다 빙수 얼음이 녹았다를 말한 장소는 어디인가요?,띵똥와플
2022-12-16,2022년 12월 16일 20시 55분에 띵똥와플에서 말했다 딸기빙수를 먹었다 빙수 얼음이 녹았다,2022년 12월 16일 20시 55분에 띵똥와플에서 어떤 감정을 느꼈나요?,빙수 얼음이 녹았다
2022-12-16,2022년 12월 16일 20시 55분에 띵똥와플에서 말했다 딸기빙수를 먹었다 빙수 얼음이 녹았다,2022년 12월 16일 20시 55분에 띵똥와플에서 한 말은 무엇인가요?,딸기빙수를 먹었다 빙수 얼음이 녹았다
2022-12-16,2022년 12월 16일 20시 55분에 띵똥와플에서 말했다 딸기빙수를 먹었다 빙수 얼음이 녹았다,딸기빙수를 먹었다 빙수 얼음이 녹았다를 어떤 날짜에 말했나요?,44911
2022-12-16,2022년 12월 16일 11시 34분에 악어떡볶이에서 말했다 싸이버거를 먹었다 치킨이 맛있었다,2022년 12월 16일 11시 34분에 악어떡볶이에서 한 말은 무엇인가요?,싸이버거를 먹었다 치킨이 맛있었다
2022-12-16,2022년 12월 16일 11시 34분에 악어떡볶이에서 말했다 싸이버거를 먹었다 치킨이 맛있었다,싸이버거를 먹었다 치킨이 맛있었다를 말한 장소는 어디인가요?,악어떡볶이
2022-12-16,2022년 12월 16일 11시 34분에 악어떡볶이에서 말했다 싸이버거를 먹었다 치킨이 맛있었다,2022년 12월 16일 11시 34분에 악어떡볶이에서 무엇을 했나요?,싸이버거를 먹었다
2022-12-16,2022년 12월 16일 11시 34분에 악어떡볶이에서 말했다 싸이버거를 먹었다 치킨이 맛있었다,싸이버거를 먹었다 치킨이 맛있었다를 말한 시간은 몇 시 인가요?, 11시 34분
2022-12-16,2022년 12월 16일 11시 34분에 악어떡볶이에서 말했다 싸이버거를 먹었다 치킨이 맛있었다,싸이버거를 먹었다 치킨이 맛있었다를 어떤 날짜에 말했나요?,44911
2022-12-16,2022년 12월 16일 11시 34분에 악어떡볶이에서 말했다 싸이버거를 먹었다 치킨이 맛있었다,2022년 12월 16일 11시 34분에 악어떡볶이에서 어떤 감정을 느꼈나요?,치킨이 맛있었다
2022-12-17,2022년 12월 17일 16시 23분에 이돈집에서 말했다 시간 웨이팅하고 마라탕을 먹었다 사장님이 친절하셨다,2022년 12월 16일 16시 23분에 이돈집에서 한 말은 무엇인가요?,시간 웨이팅하고 마라탕을 먹었다 사장님이 친절하셨다
2022-12-17,2022년 12월 17일 16시 23분에 이돈집에서 말했다 시간 웨이팅하고 마라탕을 먹었다 사장님이 친절하셨다,2022년 12월 16일 16시 23분에 이돈집에서 어떤 감정을 느꼈나요?,사장님이 친절하셨다
2022-12-17,2022년 12월 17일 16시 23분에 이돈집에서 말했다 시간 웨이팅하고 마라탕을 먹었다 사장님이 친절하셨다,2022년 12월 16일 16시 23분에 이돈집에서 무엇을 했나요?,시간 웨이팅하고 마라탕을 먹었다
2022-12-17,2022년 12월 17일 16시 23분에 이돈집에서 말했다 시간 웨이팅하고 마라탕을 먹었다 사장님이 친절하셨다,시간 웨이팅하고 마라탕을 먹었다 사장님이 친절하셨다를 말한 장소는 어디인가요?,이돈집
2022-12-17,2022년 12월 17일 16시 23분에 이돈집에서 말했다 시간 웨이팅하고 마라탕을 먹었다 사장님이 친절하셨다,시간 웨이팅하고 마라탕을 먹었다 사장님이 친절하셨다를 말한 시간은 언제인가요?,16시 23분
2022-12-17,2022년 12월 17일 16시 23분에 이돈집에서 말했다 시간 웨이팅하고 마라탕을 먹었다 사장님이 친절하셨다,시간 웨이팅하고 마라탕을 먹었다 사장님이 친절하셨다를 어떤 날짜에 말했나요?,44911
2022-12-17,2022년 12월 17일 05시 12분에 철남에서 말했다 민트초코빙수 새로 나와서 먹었다 내스타일이다,민트초코빙수 새로 나와서 먹었다 내스타일이다를 말한 장소는 어디인가요?,철남
2022-12-17,2022년 12월 17일 05시 12분에 철남에서 말했다 민트초코빙수 새로 나와서 먹었다 내스타일이다,2022년 12월 17일 05시 12분에 철남에서 한 말은 무엇인가요?,민트초코빙수 새로 나와서 먹었다 내스타일이다
2022-12-17,2022년 12월 17일 05시 12분에 철남에서 말했다 민트초코빙수 새로 나와서 먹었다 내스타일이다,2022년 12월 17일 05시 12분에 철남에서 무엇을 했나요?,민트초코빙수 새로 나와서 먹었다
2022-12-17,2022년 12월 17일 05시 12분에 철남에서 말했다 민트초코빙수 새로 나와서 먹었다 내스타일이다,2022년 12월 17일 05시 12분에 철남에서 어떤 감정을 느꼈나요?,내스타일이다
2022-12-17,2022년 12월 17일 05시 12분에 철남에서 말했다 민트초코빙수 새로 나와서 먹었다 내스타일이다,민트초코빙수 새로 나와서 먹었다 내스타일이다를 말한 시간은 몇 시 인가요?,05시 12분
2022-12-17,2022년 12월 17일 05시 12분에 철남에서 말했다 민트초코빙수 새로 나와서 먹었다 내스타일이다,민트초코빙수 새로 나와서 먹었다 내스타일이다를 어떤 날짜에 말했나요?,44912
2022-12-17,2022년 12월 17일 03시 35분에 죠스떡볶이에서 말했다 크림 파스타를 먹었다 사장님이 친절하셨다,2022년 12월 17일 03시 35분에 죠스떡볶이에서 어떤 감정을 느꼈나요?,사장님이 친절하셨다
2022-12-17,2022년 12월 17일 03시 35분에 죠스떡볶이에서 말했다 크림 파스타를 먹었다 사장님이 친절하셨다,2022년 12월 17일 03시 35분에 죠스떡볶이에서 한 말은 무엇인가요?,크림 파스타를 먹었다 사장님이 친절하셨다
2022-12-17,2022년 12월 17일 03시 35분에 죠스떡볶이에서 말했다 크림 파스타를 먹었다 사장님이 친절하셨다,크림 파스타를 먹었다 사장님이 친절하셨다를 어떤 날짜에 말했나요?,44912
2022-12-17,2022년 12월 17일 03시 35분에 죠스떡볶이에서 말했다 크림 파스타를 먹었다 사장님이 친절하셨다,크림 파스타를 먹었다 사장님이 친절하셨다를 말한 시간은 몇 시 인가요?,03시 35분
2022-12-17,2022년 12월 17일 03시 35분에 죠스떡볶이에서 말했다 크림 파스타를 먹었다 사장님이 친절하셨다,2022년 12월 17일 03시 35분에 죠스떡볶이에서 무엇을 했나요?,크림 파스타를 먹었다
2022-12-17,2022년 12월 17일 03시 35분에 죠스떡볶이에서 말했다 크림 파스타를 먹었다 사장님이 친절하셨다,크림 파스타를 먹었다 사장님이 친절하셨다를 말한 장소는 어디인가요?,죠스떡볶이
2022-12-17,2022년 12월 17일 03시 52분에 낙원스낵에서 말했다 옆테이블 아저씨가 시비를 걸었다 아저씨 때문에 기분이 나빴다,옆테이블 아저씨가 시비를 걸었다 아저씨 때문에 기분이 나빴다를 말한 시간은 몇 시 인가요?,03시 52분
2022-12-17,2022년 12월 17일 03시 52분에 낙원스낵에서 말했다 옆테이블 아저씨가 시비를 걸었다 아저씨 때문에 기분이 나빴다,옆테이블 아저씨가 시비를 걸었다 아저씨 때문에 기분이 나빴다를 말한 장소는 어디인가요?,낙원스낵
2022-12-17,2022년 12월 17일 03시 52분에 낙원스낵에서 말했다 옆테이블 아저씨가 시비를 걸었다 아저씨 때문에 기분이 나빴다,2022년 12월 17일 03시 52분에 낙원스낵에서 한 말은 무엇인가요?,옆테이블 아저씨가 시비를 걸었다 아저씨 때문에 기분이 나빴다
2022-12-17,2022년 12월 17일 03시 52분에 낙원스낵에서 말했다 옆테이블 아저씨가 시비를 걸었다 아저씨 때문에 기분이 나빴다,2022년 12월 17일 03시 52분에 낙원스낵에서 무엇을 했나요?,옆테이블 아저씨가 시비를 걸었다
2022-12-17,2022년 12월 17일 03시 52분에 낙원스낵에서 말했다 옆테이블 아저씨가 시비를 걸었다 아저씨 때문에 기분이 나빴다,2022년 12월 17일 03시 52분에 낙원스낵에서 어떤 감정을 느꼈나요?,아저씨 때문에 기분이 나빴다
2022-12-17,2022년 12월 17일 03시 52분에 낙원스낵에서 말했다 옆테이블 아저씨가 시비를 걸었다 아저씨 때문에 기분이 나빴다,옆테이블 아저씨가 시비를 걸었다 아저씨 때문에 기분이 나빴다를 어떤 날짜에 말했나요?,44912
2022-12-17,2022년 12월 17일 17시 49분에 낙원스낵에서 말했다 동기들이랑 회랑 소주를 먹었다 술이 비쌌다,동기들이랑 회랑 소주를 먹었다 술이 비쌌다를 말한 시간은 몇 시 인가요?,17시 49분
2022-12-17,2022년 12월 17일 17시 49분에 낙원스낵에서 말했다 동기들이랑 회랑 소주를 먹었다 술이 비쌌다,2022년 12월 17일 17시 49분에 낙원스낵에서 어떤 감정을 느꼈나요?,술이 비쌌다
2022-12-17,2022년 12월 17일 17시 49분에 낙원스낵에서 말했다 동기들이랑 회랑 소주를 먹었다 술이 비쌌다,2022년 12월 17일 17시 49분에 낙원스낵에서 무엇을 했나요?,동기들이랑 회랑 소주를 먹었다
2022-12-17,2022년 12월 17일 17시 49분에 낙원스낵에서 말했다 동기들이랑 회랑 소주를 먹었다 술이 비쌌다,동기들이랑 회랑 소주를 먹었다 술이 비쌌다를 말한 장소는 어디인가요?,낙원스낵
2022-12-17,2022년 12월 17일 17시 49분에 낙원스낵에서 말했다 동기들이랑 회랑 소주를 먹었다 술이 비쌌다,2022년 12월 17일 17시 49분에 낙원스낵에서 한 말은 무엇인가요?,동기들이랑 회랑 소주를 먹었다 술이 비쌌다
2022-12-17,2022년 12월 17일 17시 49분에 낙원스낵에서 말했다 동기들이랑 회랑 소주를 먹었다 술이 비쌌다,동기들이랑 회랑 소주를 먹었다 술이 비쌌다를 어떤 날짜에 말했나요?,44912
2022-12-17,2022년 12월 17일 03시 55분에 와플대학에서 말했다 기말고사가 코앞이다 오늘 소프트웨어공학 수업이 너무 힘들었다,2022년 12월 17일 03시 55분에 와플대학에서 한 말은 무엇인가요?,기말고사가 코앞이다 오늘 소프트웨어공학 수업이 너무 힘들었다
2022-12-17,2022년 12월 17일 03시 55분에 와플대학에서 말했다 기말고사가 코앞이다 오늘 소프트웨어공학 수업이 너무 힘들었다,2022년 12월 17일 03시 55분에 와플대학에서 어떤 감정을 느꼈나요?,오늘 소프트웨어공학 수업이 너무 힘들었다
2022-12-17,2022년 12월 17일 03시 55분에 와플대학에서 말했다 기말고사가 코앞이다 오늘 소프트웨어공학 수업이 너무 힘들었다,2022년 12월 17일 03시 55분에 와플대학에서 무엇을 했나요?,기말고사가 코앞이다
2022-12-17,2022년 12월 17일 03시 55분에 와플대학에서 말했다 기말고사가 코앞이다 오늘 소프트웨어공학 수업이 너무 힘들었다,기말고사가 코앞이다 오늘 소프트웨어공학 수업이 너무 힘들었다를 말한 장소는 어디인가요?,와플대학
2022-12-17,2022년 12월 17일 03시 55분에 와플대학에서 말했다 기말고사가 코앞이다 오늘 소프트웨어공학 수업이 너무 힘들었다,기말고사가 코앞이다 오늘 소프트웨어공학 수업이 너무 힘들었다를 말한 시간은 몇 시 인가요?,03시 55분
2022-12-17,2022년 12월 17일 03시 55분에 와플대학에서 말했다 기말고사가 코앞이다 오늘 소프트웨어공학 수업이 너무 힘들었다,기말고사가 코앞이다 오늘 소프트웨어공학 수업이 너무 힘들었다를 어떤 날짜에 말했나요?,44912
2022-12-17,2022년 12월 17일 10시 39분에 엘루이피자에서 말했다 옆테이블 아저씨가 시비를 걸었다 아저씨 때문에 기분이 나빴다,옆테이블 아저씨가 시비를 걸었다 아저씨 때문에 기분이 나빴다를 말한 장소는 어디인가요?,엘루이피자
2022-12-17,2022년 12월 17일 10시 39분에 엘루이피자에서 말했다 옆테이블 아저씨가 시비를 걸었다 아저씨 때문에 기분이 나빴다,옆테이블 아저씨가 시비를 걸었다 아저씨 때문에 기분이 나빴다를 말한 시간은 몇 시 인가요?,10시 39분
2022-12-17,2022년 12월 17일 10시 39분에 엘루이피자에서 말했다 옆테이블 아저씨가 시비를 걸었다 아저씨 때문에 기분이 나빴다,2022년 12월 17일 10시 39분에 엘루이피자에서 무엇을 했나요?,옆테이블 아저씨가 시비를 걸었다
2022-12-17,2022년 12월 17일 10시 39분에 엘루이피자에서 말했다 옆테이블 아저씨가 시비를 걸었다 아저씨 때문에 기분이 나빴다,2022년 12월 17일 10시 39분에 엘루이피자에서 어떤 감정을 느꼈나요?,아저씨 때문에 기분이 나빴다
2022-12-17,2022년 12월 17일 10시 39분에 엘루이피자에서 말했다 옆테이블 아저씨가 시비를 걸었다 아저씨 때문에 기분이 나빴다,2022년 12월 17일 10시 39분에 엘루이피자에서 한 말은 무엇인가요?,옆테이블 아저씨가 시비를 걸었다 아저씨 때문에 기분이 나빴다
2022-12-17,2022년 12월 17일 10시 39분에 엘루이피자에서 말했다 옆테이블 아저씨가 시비를 걸었다 아저씨 때문에 기분이 나빴다,옆테이블 아저씨가 시비를 걸었다 아저씨 때문에 기분이 나빴다를 어떤 날짜에 말했나요?,44912
2022-12-18,2022년 12월 18일 04시 39분에 엘루이피자에서 말했다 시간 웨이팅하고 마라탕을 먹었다 사장님이 친절하셨다,2022년 12월 18일 04시 39분에 엘루이피자에서 한 말은 무엇인가요?,시간 웨이팅하고 마라탕을 먹었다 사장님이 친절하셨다
2022-12-18,2022년 12월 18일 04시 39분에 엘루이피자에서 말했다 시간 웨이팅하고 마라탕을 먹었다 사장님이 친절하셨다,시간 웨이팅하고 마라탕을 먹었다 사장님이 친절하셨다를 말한 시간은 몇 시 인가요?,04시 39분
2022-12-18,2022년 12월 18일 04시 39분에 엘루이피자에서 말했다 시간 웨이팅하고 마라탕을 먹었다 사장님이 친절하셨다,시간 웨이팅하고 마라탕을 먹었다 사장님이 친절하셨다를 말한 장소는 어디인가요?,엘루이피자
2022-12-18,2022년 12월 18일 04시 39분에 엘루이피자에서 말했다 시간 웨이팅하고 마라탕을 먹었다 사장님이 친절하셨다,2022년 12월 18일 04시 39분에 엘루이피자에서 무엇을 했나요?,시간 웨이팅하고 마라탕을 먹었다
2022-12-18,2022년 12월 18일 04시 39분에 엘루이피자에서 말했다 시간 웨이팅하고 마라탕을 먹었다 사장님이 친절하셨다,2022년 12월 18일 04시 39분에 엘루이피자에서 어떤 감정을 느꼈나요?,사장님이 친절하셨다
2022-12-18,2022년 12월 18일 04시 39분에 엘루이피자에서 말했다 시간 웨이팅하고 마라탕을 먹었다 사장님이 친절하셨다,시간 웨이팅하고 마라탕을 먹었다 사장님이 친절하셨다를 어떤 날짜에 말했나요?,44913
2022-12-18,2022년 12월 18일 11시 46분에 싱싱오징어바다에서 말했다 계란찜을 먹었다 별로 맛이 없었다,계란찜을 먹었다 별로 맛이 없었다를 말한 장소는 어디인가요?,싱싱오징어바다
2022-12-18,2022년 12월 18일 11시 46분에 싱싱오징어바다에서 말했다 계란찜을 먹었다 별로 맛이 없었다,2022년 12월 18일 11시 46분에 싱싱오징어바다에서 무엇을 했나요?,계란찜을 먹었다
2022-12-18,2022년 12월 18일 11시 46분에 싱싱오징어바다에서 말했다 계란찜을 먹었다 별로 맛이 없었다,2022년 12월 18일 11시 46분에 싱싱오징어바다에서 어떤 감정을 느꼈나요?,별로 맛이 없었다
2022-12-18,2022년 12월 18일 11시 46분에 싱싱오징어바다에서 말했다 계란찜을 먹었다 별로 맛이 없었다,2022년 12월 18일 11시 46분에 싱싱오징어바다에서 한 말은 무엇인가요?,계란찜을 먹었다 별로 맛이 없었다
2022-12-18,2022년 12월 18일 11시 46분에 싱싱오징어바다에서 말했다 계란찜을 먹었다 별로 맛이 없었다,계란찜을 먹었다 별로 맛이 없었다를 어떤 날짜에 말했나요?,44913
2022-12-18,2022년 12월 18일 11시 46분에 싱싱오징어바다에서 말했다 계란찜을 먹었다 별로 맛이 없었다,계란찜을 먹었다 별로 맛이 없었다를 말한 시간은 몇 시 인가요?,11시 46분
2022-12-18,2022년 12월 18일 10시 18분에 힙덱에서 말했다 동기들이랑 회랑 소주를 먹었다 술이 비쌌다,동기들이랑 회랑 소주를 먹었다 술이 비쌌다를 어떤 날짜에 말했나요?,44913
2022-12-18,2022년 12월 18일 10시 18분에 힙덱에서 말했다 동기들이랑 회랑 소주를 먹었다 술이 비쌌다,동기들이랑 회랑 소주를 먹었다 술이 비쌌다를 말한 시간은 몇 시 인가요?,10시 18분
2022-12-18,2022년 12월 18일 10시 18분에 힙덱에서 말했다 동기들이랑 회랑 소주를 먹었다 술이 비쌌다,동기들이랑 회랑 소주를 먹었다 술이 비쌌다를 말한 장소는 어디인가요?,힙덱
2022-12-18,2022년 12월 18일 10시 18분에 힙덱에서 말했다 동기들이랑 회랑 소주를 먹었다 술이 비쌌다,2022년 12월 18일 10시 18분에 힙덱에서 무엇을 했나요?,동기들이랑 회랑 소주를 먹었다
2022-12-18,2022년 12월 18일 10시 18분에 힙덱에서 말했다 동기들이랑 회랑 소주를 먹었다 술이 비쌌다,2022년 12월 18일 10시 18분에 힙덱에서 어떤 감정을 느꼈나요?,술이 비쌌다
2022-12-18,2022년 12월 18일 10시 18분에 힙덱에서 말했다 동기들이랑 회랑 소주를 먹었다 술이 비쌌다,2022년 12월 18일 10시 18분에 힙덱에서 한 말은 무엇인가요?,동기들이랑 회랑 소주를 먹었다 술이 비쌌다
2022-12-18,2022년 12월 18일 05시 18분에 갈십리에서 말했다 떡볶이를 먹었다 떡이 딱딱했다,떡볶이를 먹었다 떡이 딱딱했다를 어떤 날짜에 말했나요?,44913
2022-12-18,2022년 12월 18일 05시 18분에 갈십리에서 말했다 떡볶이를 먹었다 떡이 딱딱했다,2022년 12월 18일 05시 18분에 갈십리에서 한 말은 무엇인가요?,떡볶이를 먹었다 떡이 딱딱했다
2022-12-18,2022년 12월 18일 05시 18분에 갈십리에서 말했다 떡볶이를 먹었다 떡이 딱딱했다,2022년 12월 18일 05시 18분에 갈십리에서 어떤 감정을 느꼈나요?,떡이 딱딱했다
2022-12-18,2022년 12월 18일 05시 18분에 갈십리에서 말했다 떡볶이를 먹었다 떡이 딱딱했다,2022년 12월 18일 05시 18분에 갈십리에서 무엇을 했나요?,떡볶이를 먹었다
2022-12-18,2022년 12월 18일 05시 18분에 갈십리에서 말했다 떡볶이를 먹었다 떡이 딱딱했다,떡볶이를 먹었다 떡이 딱딱했다를 말한 시간은 몇 시 인가요?,05시 18분
2022-12-18,2022년 12월 18일 05시 18분에 갈십리에서 말했다 떡볶이를 먹었다 떡이 딱딱했다,떡볶이를 먹었다 떡이 딱딱했다를 말한 장소는 어디인가요?,갈십리
2022-12-18,2022년 12월 18일 04시 50분에 마쿠 마라탕에서 말했다 기본 와플을 시켰다 사장님이 서비스로 초코칩을 줬다,2022년 12월 18일 04시 50분에 마쿠 마라탕에서 무엇을 했나요?,기본 와플을 시켰다
2022-12-18,2022년 12월 18일 04시 50분에 마쿠 마라탕에서 말했다 기본 와플을 시켰다 사장님이 서비스로 초코칩을 줬다,기본 와플을 시켰다 사장님이 서비스로 초코칩을 줬다를 말한 장소는 어디인가요?,마쿠 마라탕
2022-12-18,2022년 12월 18일 04시 50분에 마쿠 마라탕에서 말했다 기본 와플을 시켰다 사장님이 서비스로 초코칩을 줬다,기본 와플을 시켰다 사장님이 서비스로 초코칩을 줬다를 말한 시간은 몇 시 인가요?,04시 50분
2022-12-18,2022년 12월 18일 04시 50분에 마쿠 마라탕에서 말했다 기본 와플을 시켰다 사장님이 서비스로 초코칩을 줬다,기본 와플을 시켰다 사장님이 서비스로 초코칩을 줬다를 어떤 날짜에 말했나요?,44913
2022-12-18,2022년 12월 18일 04시 50분에 마쿠 마라탕에서 말했다 기본 와플을 시켰다 사장님이 서비스로 초코칩을 줬다,2022년 12월 18일 04시 50분에 마쿠 마라탕에서 어떤 감정을 느꼈나요?,사장님이 서비스로 초코칩을 줬다
2022-12-18,2022년 12월 18일 04시 50분에 마쿠 마라탕에서 말했다 기본 와플을 시켰다 사장님이 서비스로 초코칩을 줬다,2022년 12월 18일 04시 50분에 마쿠 마라탕에서 한 말은 무엇인가요?,기본 와플을 시켰다 사장님이 서비스로 초코칩을 줬다
2022-12-18,2022년 12월 18일 01시 43분에 정통집에서 말했다 석철이랑 제육볶음 먹었다 맛있었다,2022년 6월 26일 01시 43분에 정통집에서 어떤 감정을 느꼈나요 ?,맛있었다
2022-12-18,2022년 12월 18일 01시 43분에 정통집에서 말했다 석철이랑 제육볶음 먹었다 맛있었다,2022년 6월 26일 01시 43분에 정통집에서 무엇을 했나요 ?,석철이랑 제육볶음 먹었다
2022-12-18,2022년 12월 18일 01시 43분에 정통집에서 말했다 석철이랑 제육볶음 먹었다 맛있었다,석철이랑 제육볶음 먹었다 맛있었다를 말한 장소는 어디인가요 ?,정통집
2022-12-18,2022년 12월 18일 01시 43분에 정통집에서 말했다 석철이랑 제육볶음 먹었다 맛있었다,석철이랑 제육볶음 먹었다 맛있었다를 말한 시간은 몇 시 인가요 ?,01시 43분
2022-12-18,2022년 12월 18일 01시 43분에 정통집에서 말했다 석철이랑 제육볶음 먹었다 맛있었다,석철이랑 제육볶음 먹었다 맛있었다를 어떤 날짜에 말했나요 ?,44913
2022-12-18,2022년 12월 18일 01시 43분에 정통집에서 말했다 석철이랑 제육볶음 먹었다 맛있었다,2022년 6월 26일 01시 43분에 정통집에서 한 말은 무엇인가요?,석철이랑 제육볶음 먹었다 맛있었다
2022-12-18,2022년 12월 18일 01시 43분에 정통집에서 말했다 석철이랑 제육볶음 먹었다 맛있었다,2022년 6월 26일 01시 43분에 정통집에서 누구와 함께 행동했나요 ?,석철이
2022-12-18,2022년 12월 18일 06시 58분에 히토리우동에서 말했다 고기를 먹었는데 오늘은 맛이 없었다,2022년 12월 18일 06시 58분에 히토리우동에서 한 말은 무엇인가요?,고기를 먹었는데 오늘은 맛이 없었다
2022-12-18,2022년 12월 18일 06시 58분에 히토리우동에서 말했다 고기를 먹었는데 오늘은 맛이 없었다,2022년 12월 18일 06시 58분에 히토리우동에서 어떤 감정을 느꼈나요?,오늘은 맛이 없었다
2022-12-18,2022년 12월 18일 06시 58분에 히토리우동에서 말했다 고기를 먹었는데 오늘은 맛이 없었다,2022년 12월 18일 06시 58분에 히토리우동에서 무엇을 했나요?,고기를 먹었는데
2022-12-18,2022년 12월 18일 06시 58분에 히토리우동에서 말했다 고기를 먹었는데 오늘은 맛이 없었다,고기를 먹었는데 오늘은 맛이 없었다를 말한 장소는 어디인가요?,히토리우동
2022-12-18,2022년 12월 18일 06시 58분에 히토리우동에서 말했다 고기를 먹었는데 오늘은 맛이 없었다,고기를 먹었는데 오늘은 맛이 없었다를 말한 시간은 몇 시 인가요?,06시 58분
2022-12-18,2022년 12월 19일 06시 58분에 히토리우동에서 말했다 고기를 먹었는데 오늘은 맛이 없었다,고기를 먹었는데 오늘은 맛이 없었다를 어떤 날짜에 말했나요?,44913
2022-12-19,2022년 12월 19일 13시 00분에 싱싱오징어바다에서 말했다 동기들이랑 회랑 소주를 먹었다 술이 비쌌다,동기들이랑 회랑 소주를 먹었다 술이 비쌌다를 어떤 날짜에 말했나요?,44913
2022-12-19,2022년 12월 19일 13시 00분에 싱싱오징어바다에서 말했다 동기들이랑 회랑 소주를 먹었다 술이 비쌌다,동기들이랑 회랑 소주를 먹었다 술이 비쌌다를 말한 장소는 어디인가요?,싱싱오징어바다
2022-12-19,2022년 12월 19일 13시 00분에 싱싱오징어바다에서 말했다 동기들이랑 회랑 소주를 먹었다 술이 비쌌다,2022년 12월 18일 13시 00분에 싱싱오징어바다에서 무엇을 했나요?,동기들이랑 회랑 소주를 먹었다
2022-12-19,2022년 12월 19일 13시 00분에 싱싱오징어바다에서 말했다 동기들이랑 회랑 소주를 먹었다 술이 비쌌다,2022년 12월 18일 13시 00분에 싱싱오징어바다에서 어떤 감정을 느꼈나요?,술이 비쌌다
2022-12-19,2022년 12월 19일 13시 00분에 싱싱오징어바다에서 말했다 동기들이랑 회랑 소주를 먹었다 술이 비쌌다,동기들이랑 회랑 소주를 먹었다 술이 비쌌다를 말한 시간은 몇 시 인가요?,13시 00분
2022-12-19,2022년 12월 19일 13시 00분에 싱싱오징어바다에서 말했다 동기들이랑 회랑 소주를 먹었다 술이 비쌌다,2022년 12월 18일 13시 00분에 싱싱오징어바다에서 한 말은 무엇인가요?,동기들이랑 회랑 소주를 먹었다 술이 비쌌다
2022-12-19,2022년 12월 19일 02시 59분에 갈십리에서 말했다 한양대점 버블이 딱딱했다,2022년 12월 19일 02시 59분에 갈십리에서 한 말은 무엇인가요?,한양대점 버블이 딱딱했다
2022-12-19,2022년 12월 19일 02시 59분에 갈십리에서 말했다 한양대점 버블이 딱딱했다,한양대점 버블이 딱딱했다를 어떤 날짜에 말했나요?,44914
2022-12-19,2022년 12월 19일 02시 59분에 갈십리에서 말했다 한양대점 버블이 딱딱했다,한양대점 버블이 딱딱했다를 말한 시간은 몇 시 인가요?,02시 59분
2022-12-19,2022년 12월 19일 02시 59분에 갈십리에서 말했다 한양대점 버블이 딱딱했다,한양대점 버블이 딱딱했다를 말한 장소는 어디인가요?,갈십리
2022-12-19,2022년 12월 19일 02시 59분에 갈십리에서 말했다 한양대점 버블이 딱딱했다,2022년 12월 19일 02시 59분에 갈십리에서 어떤 감정을 느꼈나요?,한양대점 버블이 딱딱했다
2022-12-19,2022년 12월 19일 21시 06분에 와플대학에서 말했다 왕십리 이마트에서 돈까스 세일한다 이따 가야겠다,2022년 12월 19일 21시 06분에 와플대학에서 한 말은 무엇인가요?,왕십리 이마트에서 돈까스 세일한다 이따 가야겠다
2022-12-19,2022년 12월 19일 21시 06분에 와플대학에서 말했다 왕십리 이마트에서 돈까스 세일한다 이따 가야겠다,2022년 12월 19일 21시 06분에 와플대학에서 어떤 감정을 느꼈나요?,이따 가야겠다
2022-12-19,2022년 12월 19일 21시 06분에 와플대학에서 말했다 왕십리 이마트에서 돈까스 세일한다 이따 가야겠다,2022년 12월 19일 21시 06분에 와플대학에서 무엇을 했나요?,왕십리 이마트에서 돈까스 세일한다
2022-12-19,2022년 12월 19일 21시 06분에 와플대학에서 말했다 왕십리 이마트에서 돈까스 세일한다 이따 가야겠다,왕십리 이마트에서 돈까스 세일한다 이따 가야겠다를 말한 장소는 어디인가요?,와플대학
2022-12-19,2022년 12월 19일 21시 06분에 와플대학에서 말했다 왕십리 이마트에서 돈까스 세일한다 이따 가야겠다,왕십리 이마트에서 돈까스 세일한다 이따 가야겠다를 말한 시간은 몇 시 인가요?, 21시 06분
2022-12-19,2022년 12월 19일 21시 06분에 와플대학에서 말했다 왕십리 이마트에서 돈까스 세일한다 이따 가야겠다,왕십리 이마트에서 돈까스 세일한다 이따 가야겠다를 어떤 날짜에 말했나요?,44914
2022-12-19,2022년 12월 19일 02시 12분에 띵똥와플에서 말했다 딸기빙수를 먹었다 빙수 얼음이 녹았다,딸기빙수를 먹었다 빙수 얼음이 녹았다를 어떤 날짜에 말했나요?,44914
2022-12-19,2022년 12월 19일 02시 12분에 띵똥와플에서 말했다 딸기빙수를 먹었다 빙수 얼음이 녹았다,딸기빙수를 먹었다 빙수 얼음이 녹았다를 말한 시간은 몇 시 인가요?,02시 12분
2022-12-19,2022년 12월 19일 02시 12분에 띵똥와플에서 말했다 딸기빙수를 먹었다 빙수 얼음이 녹았다,2022년 12월 19일 02시 12분에 띵똥와플에서 무엇을 했나요?,딸기빙수를 먹었다
2022-12-19,2022년 12월 19일 02시 12분에 띵똥와플에서 말했다 딸기빙수를 먹었다 빙수 얼음이 녹았다,딸기빙수를 먹었다 빙수 얼음이 녹았다를 말한 장소는 어디인가요?,띵똥와플
2022-12-19,2022년 12월 19일 02시 12분에 띵똥와플에서 말했다 딸기빙수를 먹었다 빙수 얼음이 녹았다,2022년 12월 19일 02시 12분에 띵똥와플에서 한 말은 무엇인가요?,딸기빙수를 먹었다 빙수 얼음이 녹았다
2022-12-19,2022년 12월 19일 11시 32분에 정통집에서 말했다 준상이랑 고기를 먹었다 맛있었다,준상이랑 고기를 먹었다 맛있었다를 말한 장소는 어디인가요 ?,정통집
2022-12-19,2022년 12월 19일 11시 32분에 정통집에서 말했다 준상이랑 고기를 먹었다 맛있었다,준상이랑 고기를 먹었다 맛있었다를 말한 시간은 몇 시 인가요 ?,11시 32분
2022-12-19,2022년 12월 19일 11시 32분에 정통집에서 말했다 준상이랑 고기를 먹었다 맛있었다,2022년 12월 19일 11시 32분에 정통집에서 누구와 함께 행동했나요 ?,준상
2022-12-19,2022년 12월 19일 11시 32분에 정통집에서 말했다 준상이랑 고기를 먹었다 맛있었다,준상이랑 고기를 먹었다 맛있었다를 어떤 날짜에 말했나요 ?,44914
2022-12-19,2022년 12월 19일 11시 32분에 정통집에서 말했다 준상이랑 고기를 먹었다 맛있었다,2022년 12월 19일 11시 32분에 정통집에서 한 말은 무엇인가요?,준상이랑 고기를 먹었다 맛있었다
2022-12-19,2022년 12월 19일 11시 32분에 정통집에서 말했다 준상이랑 고기를 먹었다 맛있었다,2022년 12월 19일 11시 32분에 정통집에서 어떤 감정을 느꼈나요?,맛있었다
2022-12-19,2022년 12월 19일 11시 32분에 정통집에서 말했다 준상이랑 고기를 먹었다 맛있었다,2022년 12월 19일 11시 32분에 정통집에서 무엇을 했나요 ?,준상이랑 고기를 먹었다
2022-12-19,2022년 12월 19일 00시 21분에 롤링파스타에서 말했다 옆테이블 아저씨가 시비를 걸었다 아저씨 때문에 기분이 나빴다,2022년 12월 19일 00시 21분에 롤링파스타에서 한 말은 무엇인가요?,옆테이블 아저씨가 시비를 걸었다 아저씨 때문에 기분이 나빴다
2022-12-19,2022년 12월 19일 00시 21분에 롤링파스타에서 말했다 옆테이블 아저씨가 시비를 걸었다 아저씨 때문에 기분이 나빴다,2022년 12월 19일 00시 21분에 롤링파스타에서 어떤 감정을 느꼈나요?,아저씨 때문에 기분이 나빴다
2022-12-19,2022년 12월 19일 00시 21분에 롤링파스타에서 말했다 옆테이블 아저씨가 시비를 걸었다 아저씨 때문에 기분이 나빴다,옆테이블 아저씨가 시비를 걸었다 아저씨 때문에 기분이 나빴다를 어떤 날짜에 말했나요?,44914
2022-12-19,2022년 12월 19일 00시 21분에 롤링파스타에서 말했다 옆테이블 아저씨가 시비를 걸었다 아저씨 때문에 기분이 나빴다,2022년 12월 19일 00시 21분에 롤링파스타에서 무엇을 했나요?,옆테이블 아저씨가 시비를 걸었다
2022-12-19,2022년 12월 19일 00시 21분에 롤링파스타에서 말했다 옆테이블 아저씨가 시비를 걸었다 아저씨 때문에 기분이 나빴다,옆테이블 아저씨가 시비를 걸었다 아저씨 때문에 기분이 나빴다를 말한 장소는 어디인가요?,롤링파스타
2022-12-19,2022년 12월 19일 00시 21분에 롤링파스타에서 말했다 옆테이블 아저씨가 시비를 걸었다 아저씨 때문에 기분이 나빴다,옆테이블 아저씨가 시비를 걸었다 아저씨 때문에 기분이 나빴다를 말한 시간은 몇 시 인가요?,00시 21
2022-12-19,2022년 12월 19일 10시 54분에 니캉내캉에서 말했다 밥을 먹었다 지나가다가 세희를 만났다,"밥을 먹었다 지나가다가 세희를 만났다를 어떤 날짜에 말했나요?
",44914
2022-12-19,2022년 12월 19일 10시 54분에 니캉내캉에서 말했다 밥을 먹었다 지나가다가 세희를 만났다,"밥을 먹었다 지나가다가 세희를 만났다를 말한 시간은 몇 시 인가요?
",10시 54분
2022-12-19,2022년 12월 19일 10시 54분에 니캉내캉에서 말했다 밥을 먹었다 지나가다가 세희를 만났다,"밥을 먹었다 지나가다가 세희를 만났다를 말한 장소는 어디인가요?
",니캉내캉
2022-12-19,2022년 12월 19일 10시 54분에 니캉내캉에서 말했다 밥을 먹었다 지나가다가 세희를 만났다,2022년 12월 19일 10시 54분에 니캉내캉에서 무엇을 했나요?,밥을 먹었다 지나가다가 세희를 만났다
2022-12-19,2022년 12월 19일 10시 54분에 니캉내캉에서 말했다 밥을 먹었다 지나가다가 세희를 만났다,2022년 12월 19일 10시 54분에 니캉내캉에서 누구와 함께 행동했나요?,세희
2022-12-20,2022년 12월 20일 08시 48분에 와플대학에서 말했다 딸기와플을 먹었다 저렴하고 맛있었다,와플대학에서 말했다 딸기와플을 먹었다 저렴하고 맛있었다를 말한 시간은 몇 시 인가요 ?,08시 48분
2022-12-20,2022년 12월 20일 08시 48분에 와플대학에서 말했다 딸기와플을 먹었다 저렴하고 맛있었다,와플대학에서 말했다 딸기와플을 먹었다 저렴하고 맛있었다를 어떤 날짜에 말했나요 ?,44915
2022-12-20,2022년 12월 20일 08시 48분에 와플대학에서 말했다 딸기와플을 먹었다 저렴하고 맛있었다,2022년 12월 20일 08시 48분에 와플대학에서 무엇을 했나요 ?,딸기와플을 먹었다
2022-12-20,2022년 12월 20일 08시 48분에 와플대학에서 말했다 딸기와플을 먹었다 저렴하고 맛있었다,와플대학에서 말했다 딸기와플을 먹었다 저렴하고 맛있었다를 말한 장소는 어디인가요 ?,와플대학
2022-12-20,2022년 12월 20일 08시 48분에 와플대학에서 말했다 딸기와플을 먹었다 저렴하고 맛있었다,2022년 12월 20일 08시 48분에 와플대학에서어떤 감정을 느꼈나요?,저렴하고 맛있었다
2022-12-20,2022년 12월 20일 08시 48분에 와플대학에서 말했다 딸기와플을 먹었다 저렴하고 맛있었다,2022년 12월 20일 08시 48분에 와플대학에서 한 말은 무엇인가요?,딸기와플을 먹었다 저렴하고 맛있었다
2022-12-20,2022년 12월 20일 01시 38분에 여우주막에서 말했다 오늘 하늘이가 나한테 화냈다 무슨 일 때문이지,오늘 하늘이가 나한테 화냈다 무슨 일 때문이지를 말한 장소는 어디인가요?,여우주막
2022-12-20,2022년 12월 20일 01시 38분에 여우주막에서 말했다 오늘 하늘이가 나한테 화냈다 무슨 일 때문이지,2022년 12월 20일 01시 38분에 여우주막에서 무엇을 했나요?,오늘 하늘이가 나한테 화냈다
2022-12-20,2022년 12월 20일 01시 38분에 여우주막에서 말했다 오늘 하늘이가 나한테 화냈다 무슨 일 때문이지,2022년 12월 20일 01시 38분에 여우주막에서 어떤 감정을 느꼈나요?,무슨 일 때문이지
2022-12-20,2022년 12월 20일 01시 38분에 여우주막에서 말했다 오늘 하늘이가 나한테 화냈다 무슨 일 때문이지,오늘 하늘이가 나한테 화냈다 무슨 일 때문이지를 어떤 날짜에 말했나요?,44915
2022-12-20,2022년 12월 20일 01시 38분에 여우주막에서 말했다 오늘 하늘이가 나한테 화냈다 무슨 일 때문이지,2022년 12월 20일 01시 38분에 여우주막에서 한 말은 무엇인가요?,오늘 하늘이가 나한테 화냈다 무슨 일 때문이지
2022-12-20,2022년 12월 20일 01시 38분에 여우주막에서 말했다 오늘 하늘이가 나한테 화냈다 무슨 일 때문이지,오늘 하늘이가 나한테 화냈다 무슨 일 때문이지를 말한 시간은 몇 시 인가요?,01시 38분
2022-12-20,2022년 12월 20일 00시 53분에 끄트머리집에서 말했다 기말고사가 코앞이다 오늘 소프트웨어공학 수업이 너무 힘들었다,2022년 12월 20일 00시 53분에 끄트머리집에서 한 말은 무엇인가요?,기말고사가 코앞이다 오늘 소프트웨어공학 수업이 너무 힘들었다
2022-12-20,2022년 12월 20일 00시 53분에 끄트머리집에서 말했다 기말고사가 코앞이다 오늘 소프트웨어공학 수업이 너무 힘들었다,기말고사가 코앞이다 오늘 소프트웨어공학 수업이 너무 힘들었다를 어떤 날짜에 말했나요?,44915
2022-12-20,2022년 12월 20일 00시 53분에 끄트머리집에서 말했다 기말고사가 코앞이다 오늘 소프트웨어공학 수업이 너무 힘들었다,2022년 12월 20일 00시 53분에 끄트머리집에서 무엇을 했나요?,기말고사가 코앞이다
2022-12-20,2022년 12월 20일 00시 53분에 끄트머리집에서 말했다 기말고사가 코앞이다 오늘 소프트웨어공학 수업이 너무 힘들었다,기말고사가 코앞이다 오늘 소프트웨어공학 수업이 너무 힘들었다를 말한 시간은 몇 시 인가요?,00시 53분
2022-12-20,2022년 12월 20일 00시 53분에 끄트머리집에서 말했다 기말고사가 코앞이다 오늘 소프트웨어공학 수업이 너무 힘들었다,2022년 12월 20일 00시 53분에 끄트머리집에서 어떤 감정을 느꼈나요?,오늘 소프트웨어공학 수업이 너무 힘들었다
2022-12-20,2022년 12월 20일 00시 53분에 끄트머리집에서 말했다 기말고사가 코앞이다 오늘 소프트웨어공학 수업이 너무 힘들었다,기말고사가 코앞이다 오늘 소프트웨어공학 수업이 너무 힘들었다를 말한 장소는 어디인가요?,끄트머리집
2022-12-20,2022년 12월 20일 17시 01분에 낙원스낵에서 말했다 떡볶이를 먹었다 떡이 딱딱했다,떡볶이를 먹었다 떡이 딱딱했다를 어떤 날짜에 말했나요?,44915
2022-12-20,2022년 12월 20일 17시 01분에 낙원스낵에서 말했다 떡볶이를 먹었다 떡이 딱딱했다,2022년 12월 20일 17시 01분에 낙원스낵에서 한 말은 무엇인가요?,떡볶이를 먹었다 떡이 딱딱했다
2022-12-20,2022년 12월 20일 17시 01분에 낙원스낵에서 말했다 떡볶이를 먹었다 떡이 딱딱했다,2022년 12월 20일 17시 01분에 낙원스낵에서 어떤 감정을 느꼈나요?,떡이 딱딱했다
2022-12-20,2022년 12월 20일 17시 01분에 낙원스낵에서 말했다 떡볶이를 먹었다 떡이 딱딱했다,2022년 12월 20일 17시 01분에 낙원스낵에서 무엇을 했나요?,떡볶이를 먹었다
2022-12-20,2022년 12월 20일 17시 01분에 낙원스낵에서 말했다 떡볶이를 먹었다 떡이 딱딱했다,떡볶이를 먹었다 떡이 딱딱했다를 말한 장소는 어디인가요?,낙원스낵
2022-12-20,2022년 12월 20일 17시 01분에 낙원스낵에서 말했다 떡볶이를 먹었다 떡이 딱딱했다,떡볶이를 먹었다 떡이 딱딱했다를 말한 시간은 몇 시 인가요?,17시 01분
2022-12-20,2022년 12월 20일 02시 17분에 엘루이피자에서 말했다 가게 사장님이 대통령 표창장을 받았다 고기는 맛이 없었다,2022년 12월 20일 02시 17분에 엘루이피자에서 무엇을 했나요?,가게 사장님이 대통령 표창장을 받았다
2022-12-20,2022년 12월 20일 02시 17분에 엘루이피자에서 말했다 가게 사장님이 대통령 표창장을 받았다 고기는 맛이 없었다,가게 사장님이 대통령 표창장을 받았다 고기는 맛이 없었다를 말한 장소는 어디인가요?,엘루이피자
2022-12-20,2022년 12월 20일 02시 17분에 엘루이피자에서 말했다 가게 사장님이 대통령 표창장을 받았다 고기는 맛이 없었다,가게 사장님이 대통령 표창장을 받았다 고기는 맛이 없었다를 말한 시간은 몇 시 인가요?,02시 17분
2022-12-20,2022년 12월 20일 02시 17분에 엘루이피자에서 말했다 가게 사장님이 대통령 표창장을 받았다 고기는 맛이 없었다,가게 사장님이 대통령 표창장을 받았다 고기는 맛이 없었다를 어떤 날짜에 말했나요?,44915
2022-12-20,2022년 12월 20일 02시 17분에 엘루이피자에서 말했다 가게 사장님이 대통령 표창장을 받았다 고기는 맛이 없었다,2022년 12월 20일 02시 17분에 엘루이피자에서 어떤 감정을 느꼈나요?,고기는 맛이 없었다
2022-12-20,2022년 12월 20일 02시 17분에 엘루이피자에서 말했다 가게 사장님이 대통령 표창장을 받았다 고기는 맛이 없었다,2022년 12월 20일 02시 17분에 엘루이피자에서 한 말은 무엇인가요?,가게 사장님이 대통령 표창장을 받았다 고기는 맛이 없었다
2022-12-20,2022년 12월 20일 01시 48분에 끄트머리집에서 말했다 한양대점 버블티를 먹었다 알바생이 친절했다,2022년 12월 20일 01시 48분에 끄트머리집에서 무엇을 했나요?,한양대점 버블티를 먹었다
2022-12-20,2022년 12월 20일 01시 48분에 끄트머리집에서 말했다 한양대점 버블티를 먹었다 알바생이 친절했다,2022년 12월 20일 01시 48분에 끄트머리집에서 어떤 감정을 느꼈나요?,알바생이 친절했다
2022-12-20,2022년 12월 20일 01시 48분에 끄트머리집에서 말했다 한양대점 버블티를 먹었다 알바생이 친절했다,한양대점 버블티를 먹었다 알바생이 친절했다를 말한 장소는 어디인가요?,끄트머리집
2022-12-20,2022년 12월 20일 01시 48분에 끄트머리집에서 말했다 한양대점 버블티를 먹었다 알바생이 친절했다,한양대점 버블티를 먹었다 알바생이 친절했다를 말한 시간은 몇 시 인가요?,01시 48분
2022-12-20,2022년 12월 20일 01시 48분에 끄트머리집에서 말했다 한양대점 버블티를 먹었다 알바생이 친절했다,한양대점 버블티를 먹었다 알바생이 친절했다를 어떤 날짜에 말했나요?,44915
2022-12-20,2022년 12월 20일 01시 48분에 끄트머리집에서 말했다 한양대점 버블티를 먹었다 알바생이 친절했다,2022년 12월 20일 01시 48분에 끄트머리집에서 한 말은 무엇인가요?,한양대점 버블티를 먹었다 알바생이 친절했다
2022-12-20,2022년 12월 20일 15시 05분에 일락라멘에서 말했다 싸이버거를 먹었다 치킨이 맛있었다,2022년 12월 20일 15시 05분에 일락라멘에서 무엇을 했나요?,싸이버거를 먹었다
2022-12-20,2022년 12월 20일 15시 05분에 일락라멘에서 말했다 싸이버거를 먹었다 치킨이 맛있었다,싸이버거를 먹었다 치킨이 맛있었다를 어떤 날짜에 말했나요?,44915
2022-12-20,2022년 12월 20일 15시 05분에 일락라멘에서 말했다 싸이버거를 먹었다 치킨이 맛있었다,싸이버거를 먹었다 치킨이 맛있었다를 말한 시간은 몇 시 인가요?,15시 05분
2022-12-20,2022년 12월 20일 15시 05분에 일락라멘에서 말했다 싸이버거를 먹었다 치킨이 맛있었다,싸이버거를 먹었다 치킨이 맛있었다를 말한 장소는 어디인가요?,일락라멘
2022-12-20,2022년 12월 20일 15시 05분에 일락라멘에서 말했다 싸이버거를 먹었다 치킨이 맛있었다,2022년 12월 20일 15시 05분에 일락라멘에서 어떤 감정을 느꼈나요?,치킨이 맛있었다
2022-12-20,2022년 12월 20일 15시 05분에 일락라멘에서 말했다 싸이버거를 먹었다 치킨이 맛있었다,2022년 12월 20일 15시 05분에 일락라멘에서 한 말은 무엇인가요?,싸이버거를 먹었다 치킨이 맛있었다
2022-12-21,2022년 12월 21일 11시 53분에 여우주막에서 말했다 제육볶음 먹었다 고기가 딱딱했다,2022년 12월 20일 11시 53분에 여우주막에서 어떤 감정을 느꼈나요?,고기가 딱딱했다
2022-12-21,2022년 12월 21일 11시 53분에 여우주막에서 말했다 제육볶음 먹었다 고기가 딱딱했다,제육볶음 먹었다 고기가 딱딱했다를 말한 장소는 어디인가요?,여우주막
2022-12-21,2022년 12월 21일 11시 53분에 여우주막에서 말했다 제육볶음 먹었다 고기가 딱딱했다,제육볶음 먹었다 고기가 딱딱했다를 말한 시간은 몇 시 인가요?,11시 53분
2022-12-21,2022년 12월 21일 11시 53분에 여우주막에서 말했다 제육볶음 먹었다 고기가 딱딱했다,제육볶음 먹었다 고기가 딱딱했다를 어떤 날짜에 말했나요?,44915
2022-12-21,2022년 12월 21일 11시 53분에 여우주막에서 말했다 제육볶음 먹었다 고기가 딱딱했다,2022년 12월 20일 11시 53분에 여우주막에서 한 말은 무엇인가요?,제육볶음 먹었다 고기가 딱딱했다
2022-12-21,2022년 12월 21일 11시 53분에 여우주막에서 말했다 제육볶음 먹었다 고기가 딱딱했다,2022년 12월 20일 11시 53분에 여우주막에서 무엇을 했나요?,제육볶음 먹었다
2022-12-21,2022년 12월 21일 17시 29분에 히토리우동에서 말했다 제육볶음을 먹었다 양파가 많았다,제육볶음을 먹었다 양파가 많았다를 어떤 날짜에 말했나요?,44916
2022-12-21,2022년 12월 21일 17시 29분에 히토리우동에서 말했다 제육볶음을 먹었다 양파가 많았다,제육볶음을 먹었다 양파가 많았다를 말한 장소는 어디인가요?,히토리우동
2022-12-21,2022년 12월 21일 17시 29분에 히토리우동에서 말했다 제육볶음을 먹었다 양파가 많았다,2022년 12월 21일 17시 29분에 히토리우동에서 한 말은 무엇인가요?,제육볶음을 먹었다 양파가 많았다
2022-12-21,2022년 12월 21일 17시 29분에 히토리우동에서 말했다 제육볶음을 먹었다 양파가 많았다,2022년 12월 21일 17시 29분에 히토리우동에서 어떤 감정을 느꼈나요?,양파가 많았다
2022-12-21,2022년 12월 21일 17시 29분에 히토리우동에서 말했다 제육볶음을 먹었다 양파가 많았다,2022년 12월 21일 17시 29분에 히토리우동에서 무엇을 했나요?,제육볶음을 먹었다
2022-12-21,2022년 12월 21일 17시 29분에 히토리우동에서 말했다 제육볶음을 먹었다 양파가 많았다,제육볶음을 먹었다 양파가 많았다를 말한 시간은 몇 시 인가요?,17시 29분
2022-12-21,2022년 12월 21일 10시 22분에 김부삼에서 말했다 밥을 먹었다 지나가다가 세희를 만났다,밥을 먹었다 지나가다가 세희를 만났다를 어떤 날짜에 말했나요?,44916
2022-12-21,2022년 12월 21일 10시 22분에 김부삼에서 말했다 밥을 먹었다 지나가다가 세희를 만났다,밥을 먹었다 지나가다가 세희를 만났다를 말한 시간은 몇 시 인가요?,10시 22분
2022-12-21,2022년 12월 21일 10시 22분에 김부삼에서 말했다 밥을 먹었다 지나가다가 세희를 만났다,밥을 먹었다 지나가다가 세희를 만났다를 말한 장소는 어디인가요?,김부삼
2022-12-21,2022년 12월 21일 10시 22분에 김부삼에서 말했다 밥을 먹었다 지나가다가 세희를 만났다,2022년 12월 21일 10시 22분에 김부삼에서 무엇을 했나요?,밥을 먹었다
2022-12-21,2022년 12월 21일 10시 22분에 김부삼에서 말했다 밥을 먹었다 지나가다가 세희를 만났다,2022년 12월 21일 10시 22분에 김부삼에서 누구와 함께 행동했나요?,세희
2022-12-21,2022년 12월 21일 10시 22분에 김부삼에서 말했다 밥을 먹었다 지나가다가 세희를 만났다,2022년 12월 21일 10시 22분에 김부삼에서 한 말은 무엇인가요?,밥을 먹었다 지나가다가 세희를 만났다
2022-12-21,2022년 12월 21일 18시 20분에 설빙에서 말했다 딸기빙수를 먹었다 빙수 얼음이 녹았다,딸기빙수를 먹었다 빙수 얼음이 녹았다를 말한 시간은 몇 시 인가요?,18시 20분
2022-12-21,2022년 12월 21일 18시 20분에 설빙에서 말했다 딸기빙수를 먹었다 빙수 얼음이 녹았다,딸기빙수를 먹었다 빙수 얼음이 녹았다를 어떤 날짜에 말했나요?,44916
2022-12-21,2022년 12월 21일 18시 20분에 설빙에서 말했다 딸기빙수를 먹었다 빙수 얼음이 녹았다,2022년 12월 21일 18시 20분에 설빙에서 무엇을 했나요?,딸기빙수를 먹었다
2022-12-21,2022년 12월 21일 18시 20분에 설빙에서 말했다 딸기빙수를 먹었다 빙수 얼음이 녹았다,딸기빙수를 먹었다 빙수 얼음이 녹았다를 말한 장소는 어디인가요?,설빙
2022-12-21,2022년 12월 21일 18시 20분에 설빙에서 말했다 딸기빙수를 먹었다 빙수 얼음이 녹았다,2022년 12월 21일 18시 20분에 설빙에서 어떤 감정을 느꼈나요?,빙수 얼음이 녹았다
2022-12-21,2022년 12월 21일 18시 20분에 설빙에서 말했다 딸기빙수를 먹었다 빙수 얼음이 녹았다,2022년 12월 21일 18시 20분에 설빙에서 한 말은 무엇인가요?,딸기빙수를 먹었다 빙수 얼음이 녹았다
2022-12-21,2022년 12월 21일 22시 10분에 집에서 말했다 집에 도착 하자마자 세탁기를 돌렸다 기분이 좋았다,집에 도착 하자마자 세탁기를 돌렸다 기분이 좋았다를 어떤 날짜에 말했나요?,44916
2022-12-21,2022년 12월 21일 22시 10분에 집에서 말했다 집에 도착 하자마자 세탁기를 돌렸다 기분이 좋았다,집에 도착 하자마자 세탁기를 돌렸다 기분이 좋았다를 말한 시간은 몇 시 인가요?,0.9236111111111112
2022-12-21,2022년 12월 21일 22시 10분에 집에서 말했다 집에 도착 하자마자 세탁기를 돌렸다 기분이 좋았다,집에 도착 하자마자 세탁기를 돌렸다 기분이 좋았다를 말한 장소는 어디인가요?,집
2022-12-21,2022년 12월 21일 22시 10분에 집에서 말했다 집에 도착 하자마자 세탁기를 돌렸다 기분이 좋았다,2022년 12월 21일 22시 10분에 집에서 무엇을 했나요?,집에 도착 하자마자 세탁기를 돌렸다
2022-12-21,2022년 12월 21일 22시 10분에 집에서 말했다 집에 도착 하자마자 세탁기를 돌렸다 기분이 좋았다,2022년 12월 21일 22시 10분에 집에서 한 말은 무엇인가요?,집에 도착 하자마자 세탁기를 돌렸다 기분이 좋았다
2022-12-21,2022년 12월 21일 22시 10분에 집에서 말했다 집에 도착 하자마자 세탁기를 돌렸다 기분이 좋았다,2022년 12월 21일 22시 10분에 집에서 어떤 감정을 느꼈나요?,기분이 좋았다
2022-12-21,2022년 12월 21일 20시 40분에 집에서 말했다 냉장고를 새로 샀는데 냉장고 색깔을 계속 바꿀 수 있다 신기하다,냉장고를 새로 샀는데 냉장고 색깔을 계속 바꿀 수 있다 신기하다를 어떤 날짜에 말했나요?,44916
2022-12-21,2022년 12월 21일 20시 40분에 집에서 말했다 냉장고를 새로 샀는데 냉장고 색깔을 계속 바꿀 수 있다 신기하다,냉장고를 새로 샀는데 냉장고 색깔을 계속 바꿀 수 있다 신기하다를 말한 시간은 몇 시 인가요?,0.8611111111111112
2022-12-21,2022년 12월 21일 20시 40분에 집에서 말했다 냉장고를 새로 샀는데 냉장고 색깔을 계속 바꿀 수 있다 신기하다,냉장고를 새로 샀는데 냉장고 색깔을 계속 바꿀 수 있다 신기하다를 말한 장소는 어디인가요?,집
2022-12-21,2022년 12월 21일 20시 40분에 집에서 말했다 냉장고를 새로 샀는데 냉장고 색깔을 계속 바꿀 수 있다 신기하다,2022년 12월 21일 20시 40분에 집에서 한 말은 무엇인가요?,냉장고를 새로 샀는데 냉장고 색깔을 계속 바꿀 수 있다 신기하다
2022-12-21,2022년 12월 21일 20시 40분에 집에서 말했다 냉장고를 새로 샀는데 냉장고 색깔을 계속 바꿀 수 있다 신기하다,2022년 12월 21일 20시 40분에 집에서 어떤 감정을 느꼈나요?,신기하다
2022-12-21,2022년 12월 21일 08시 50분에 교보문고에서 말했다 신간 책들이 많이 나왔다 다 사고 싶다,신간 책들이 많이 나왔다 다 사고 싶다를 어떤 날짜에 말했나요?,44916
2022-12-21,2022년 12월 21일 08시 50분에 교보문고에서 말했다 신간 책들이 많이 나왔다 다 사고 싶다,신간 책들이 많이 나왔다 다 사고 싶다를 말한 시간은 몇 시 인가요?,0.3680555555555556
2022-12-21,2022년 12월 21일 08시 50분에 교보문고에서 말했다 신간 책들이 많이 나왔다 다 사고 싶다,신간 책들이 많이 나왔다 다 사고 싶다를 말한 장소는 어디인가요?,교보문고
2022-12-21,2022년 12월 21일 08시 50분에 교보문고에서 말했다 신간 책들이 많이 나왔다 다 사고 싶다,2022년 12월 21일 08시 50분에 교보문고에서 한 말은 무엇인가요?,신간 책들이 많이 나왔다 다 사고 싶다
2022-12-21,2022년 12월 21일 08시 50분에 교보문고에서 말했다 신간 책들이 많이 나왔다 다 사고 싶다,2022년 12월 21일 08시 50분에 교보문고에서 어떤 감정을 느꼈나요?,다 사고 싶다
